// DO NOT EDIT. This is code generated via package:intl/generate_localized.dart
// This is a library that provides messages for a ja_JP locale. All the
// messages from the main program should be duplicated here with the same
// function name.

// ignore_for_file: unnecessary_brace_in_string_interps

import 'package:intl/intl.dart';
import 'package:intl/message_lookup_by_library.dart';

// ignore: unnecessary_new
final messages = new MessageLookup();

// ignore: unused_element
final _keepAnalysisHappy = Intl.defaultLocale;

// ignore: non_constant_identifier_names
typedef MessageIfAbsent(String message_str, List args);

class MessageLookup extends MessageLookupByLibrary {
  get localeName => 'ja_JP';

  static m0(startTag0, endTag0) => "After I was asked again and again whether I could be donated, I decided to make such a possibility available. Nightscout Reporter is still completely free and will stay that way. If you still want to express your affection for the program, I don\'t want to stand in your way any longer. The donation button is not visible. But if you want to throw something in the ${startTag0}hat${endTag0}, you will find it :)";

  static m1(count) => "${Intl.plural(count, zero: '', one: '1 ページ', other: '${count} ページ')}";

  static m2(count) => "${Intl.plural(count, zero: '', one: '1 ページ以上', other: '${count} ページ以上')}";

  static m3(isVisible) => "The Access Token is only required if access in Nightscout was restricted via AUTH_DEFAULT_ROLES";

  static m4(time) => "ベーサルレートは ${time} から有効で、一時的な変更はありません。";

  static m5(unit) => "このベーサルレートは ${unit} で有効でした";

  static m6(value) => "ベーサルレート/日(${value})";

  static m7(value) => "ベーサルレート：プロファイル設定(${value})";

  static m8(value) => "ボーラス インスリン(${value})";

  static m9(value) => "血糖変動係数${value}%]";

  static m10(date) => "${date} を確認しています...";

  static m11(scale, intercept, slope) => "キャリブレーション (scale ${scale} / intercept ${intercept} / slope ${slope})";

  static m12(value) => "食事ボーラス(${value})";

  static m13(value) => "炭水化物 (${value}g)";

  static m14(count, txt) => "${Intl.plural(count, zero: '', one: '(${txt} 日間/カニューレ)', other: '(${txt} 日間/カニューレ)')}";

  static m15(name, from, to) => "${name} ${from} => ${to}";

  static m16(url) => "${url} へのアクセスを確認中…";

  static m17(count) => "${Intl.plural(count, zero: 'Deselect a column@nl@to be able to activate another one', one: 'One more column available', other: '${count} columns still available')}";

  static m18(value) => "補正ボーラス(${value})";

  static m19(value) => "${Intl.plural(value, zero: '値なし', one: '1個', other: '${value} 個')}";

  static m20(value) => "${value} 日";

  static m21(hours, minutes) => "${hours} 時間 ${minutes} 分";

  static m22(isVisible) => "データを含む直近の日の日付";

  static m23(beg, end) => "${beg} - ${end}";

  static m24(count) => "${Intl.plural(count, zero: '', one: '1 Form', other: '${count} Forms')}";

  static m25(max) => "不良 (${max} 超)";

  static m26(min, max) => "良 (${min} to ${max})";

  static m27(min) => "利用不可(${min} 分未満)";

  static m28(min, max) => "良好 (${min}～${max})";

  static m29(unit, value) => "強い高血糖\n[${unit} x min²]";

  static m30(unit) => "高血糖の強さ/日(${unit} 以上)";

  static m31(unit, value) => "強い低血糖\n[${unit} x min²]";

  static m32(unit) => "低血糖の強さ/日(${unit} 以下)";

  static m33(value) => "血糖値高${value}";

  static m34(value) => "履歴 ${value}";

  static m35(value) => "低血糖 (< ${value})";

  static m36(unit) => "インスリン効果値(ISF) 1 IUでX ${unit} の血糖値が下がる";

  static m37(value) => "${value}g";

  static m38(value) => "g CH (${value} BU)";

  static m39(value) => "1日の総インスリン量 (${value})";

  static m40(error, stacktrace) => "データ読込エラー:${error}${stacktrace}";

  static m41(date) => "データを${date} より取得しています…";

  static m42(insulin, unit) => "Microbolus ${insulin} ${unit}";

  static m43(range, duration, reason, scale) => "temp. Override for ${duration} min, Reason: ${reason}, Targetrange: ${range}, Scale: ${scale}%";

  static m44(insulin, unit) => "SMB${insulin}${unit}";

  static m45(percent, duration) => "一時基礎量 ${percent}%/${duration} 分";

  static m46(value, duration) => "一時基礎${value} / ${duration} min";

  static m47(target, duration, reason) => "目標範囲${target}、${duration} 分、理由：${reason}";

  static m48(value) => "血糖値低 ${value}";

  static m49(gluc, unit) => "血糖値 ${gluc}${unit}";

  static m50(unit, value) => "平均血糖値[${unit}]";

  static m51(hba1c) => "指定期間の平均血糖値";

  static m52(name) => "Use profile \"${name}\"";

  static m53(name) => "The profile with the name \"${name}\" could not be found. This must be set up in the profile editor on the Nightscout page. A profile must be set up there with the name \"${name}\" in order to be able to generate this form. The link below opens the profile editor. Under certain circumstances, the authentication must then be carried out at the very bottom of the page in order to be able to change the values.";

  static m54(min, max) => "不良 (${min} to ${max})";

  static m55(min, max) => "良好 (${min} to ${max})";

  static m56(max) => "とても悪い ( ${max} 超)";

  static m57(min) => "優秀 (${min} 未満)";

  static m58(oldName, newName) => "プロフィール変更 - ${oldName} => ${newName}";

  static m59(oldName, newName, duration) => "プロフィール変更 - ${oldName} => ${newName} から ${duration} 分";

  static m60(howMany, fmt) => "${Intl.plural(howMany, zero: 'データがありません', one: '1件のデータ/分', other: '${fmt}分毎にデータ')}";

  static m61(howMany, fmt) => "${Intl.plural(howMany, zero: '値がありません', one: '1日あたり1データ', other: '1日あたり${fmt}データ')}";

  static m62(howMany, fmt) => "${Intl.plural(howMany, zero: 'データがありません', one: '1件のデータ/時間', other: '${fmt} 件のデータ/時間')}";

  static m63(count, txt) => "${Intl.plural(count, zero: '', one: '(${txt} 日間/リザーバー)', other: '(${txt} 日間/リザーバー)')}";

  static m64(value) => "SMB(${value})";

  static m65(count, txt) => "${Intl.plural(count, zero: '', one: '(${txt} 日間/センサー)', other: '(${txt} 日間/センサー)')}";

  static m66(low, high, unit) => "標準の目標範囲を使用 (${low} ${unit} - ${high} ${unit})";

  static m67(isVisible) => "データがある最初の日の日付";

  static m68(value) => "(標準偏差 ${value})";

  static m69(value) => "ToR [${value}分/時]";

  static m70(min, max) => "1日あたりの目標範囲外の時間${min} から${max}。";

  static m71(unit) => "血糖値目標範囲${unit}";

  static m72(min, max, units) => "目標範囲 (${min} - ${max} ${units})";

  static m73(value) => "目標値";

  static m74(time) => "${time}";

  static m75(time) => "午前${time}";

  static m76(time) => "午後${time}";

  static m77(maxCount, count, text) => "${Intl.plural(count, zero: '', one: 'The uploader \"${text}\" has created the data records.', other: 'The following uploaders have created the data records: ${text}')}";

  static m78(maxCount) => "Not all profiles could be loaded because more than ${maxCount} are saved in the selected period. ";

  static m79(begDate) => "${begDate} から有効";

  static m80(begDate, endDate) => "${begDate} から${endDate} まで有効";

  static m81(endDate) => "${endDate} まで有効";

  static m82(high) => "${high} 以上の値";

  static m83(low) => "${low} 未満の値";

  static m84(low, high) => "${low} から ${high} の値";

  static m85(low, high) => "目標範囲 (${low} - ${high})";

  static m86(value) => "高血糖 (${value})";

  static m87(value) => "低血糖 (${value})";

  static m88(value) => "重篤な高血糖 ( > ${value})";

  static m89(value) => "重篤な低血糖(< ${value})";

  final messages = _notInlinedMessages(_notInlinedMessages);
  static _notInlinedMessages(_) => <String, Function> {
    "0,0 bis 2,0" : MessageLookupByLibrary.simpleMessage("0,0 ～ 2,0"),
    "1 Minute" : MessageLookupByLibrary.simpleMessage("1 分"),
    "1 Stunde" : MessageLookupByLibrary.simpleMessage("1時間"),
    "1.0.0 - 20.10.2018" : MessageLookupByLibrary.simpleMessage("1.0.0 - 2018/10/20"),
    "1.0.1 - 23.10.2018" : MessageLookupByLibrary.simpleMessage("1.0.1 - 2018/10/23"),
    "1.0.2 - 23.10.2018" : MessageLookupByLibrary.simpleMessage("1.0.2 - 2018/10/23"),
    "1.0.3 - 26.10.2018" : MessageLookupByLibrary.simpleMessage("1.0.3 - 2018/10/26"),
    "1.0.4 - 28.10.2018" : MessageLookupByLibrary.simpleMessage("1.0.4 - 2018/10/28"),
    "1.1.0 - 09.11.2018" : MessageLookupByLibrary.simpleMessage("1.1.0 - 2018/11/09"),
    "1.1.1 - 19.11.2018" : MessageLookupByLibrary.simpleMessage("1.1.1 - 2018/11/19"),
    "1.1.2 - 08.01.2019" : MessageLookupByLibrary.simpleMessage("1.1.2 - 2019/08/01"),
    "1.2.0 - 21.01.2019" : MessageLookupByLibrary.simpleMessage("1.2.0 - 2019/01/21"),
    "1.2.1 - 22.01.2019" : MessageLookupByLibrary.simpleMessage("1.2.1 - 2019/01/22"),
    "1.2.10 - 18.04.2019" : MessageLookupByLibrary.simpleMessage("1.2.10 - 2019/04/18"),
    "1.2.11 - 17.05.2019" : MessageLookupByLibrary.simpleMessage("1.2.11 - 2019/05/17"),
    "1.2.2 - 24.01.2019" : MessageLookupByLibrary.simpleMessage("1.2.2 - 2019/01/24"),
    "1.2.3 - 04.02.2019" : MessageLookupByLibrary.simpleMessage("1.2.3 - 2019/04/02"),
    "1.2.4 - 12.02.2019" : MessageLookupByLibrary.simpleMessage("1.2.4 - 2019/02/12"),
    "1.2.5 - 25.03.2019" : MessageLookupByLibrary.simpleMessage("1.2.5 - 2019/03/25"),
    "1.2.6 - 27.03.2019" : MessageLookupByLibrary.simpleMessage("1.2.6 - 2019/03/27"),
    "1.2.7 - 28.03.2019" : MessageLookupByLibrary.simpleMessage("1.2.7 - 28/03/2019"),
    "1.2.8 - 11.04.2019" : MessageLookupByLibrary.simpleMessage("1.2.8 - 2019/04/11"),
    "1.2.9 - 15.04.2019" : MessageLookupByLibrary.simpleMessage("1.2.9 - 2019/4/15"),
    "1.3.0 - 19.08.2019" : MessageLookupByLibrary.simpleMessage("1.3.0 - 2019/08/19"),
    "1.3.1 - 22.08.2019" : MessageLookupByLibrary.simpleMessage("1.3.1 - 2019/08/22"),
    "1.3.2 - 05.09.2019" : MessageLookupByLibrary.simpleMessage("1.3.2 - 2019/09/05"),
    "1.3.3 - 12.09.2019" : MessageLookupByLibrary.simpleMessage("1.3.3 - 2019/09/12"),
    "1.3.4 - 17.09.2019" : MessageLookupByLibrary.simpleMessage("1.3.4 - 2019/09/17"),
    "1.3.5 - 23.09.2019" : MessageLookupByLibrary.simpleMessage("1.3.5 ‐ 2019/09/23"),
    "1.3.6 - 18.12.2019" : MessageLookupByLibrary.simpleMessage("1.3.6 - 18/12/2019"),
    "1.3.7 - 7.1.2020" : MessageLookupByLibrary.simpleMessage("1.3.7 - 7/1/2020"),
    "1.3.8 - 9.1.2020" : MessageLookupByLibrary.simpleMessage("1.3.8 - 9/1/2020"),
    "1.4 - 28.2.2020" : MessageLookupByLibrary.simpleMessage("1.4 - 28/2/2020"),
    "1.4.1 - 13.3.2020" : MessageLookupByLibrary.simpleMessage("1.4.1 - 13/3/2020"),
    "1.4.2 - 16.3.2020" : MessageLookupByLibrary.simpleMessage("1.4.2 - 16/3/2020"),
    "1.4.3 - 26.3.2020" : MessageLookupByLibrary.simpleMessage("1.4.3 - 26/3/2020"),
    "1.4.4 - 6.4.2020" : MessageLookupByLibrary.simpleMessage("1.4.4 - 6/4/2020"),
    "1.4.5 - 20.4.2020" : MessageLookupByLibrary.simpleMessage("1.4.5 - 20/4/2020"),
    "1.4.6 - 26.5.2020" : MessageLookupByLibrary.simpleMessage("1.4.6 - 26/5/2020"),
    "1.4.7 - 5.6.2020" : MessageLookupByLibrary.simpleMessage("1.4.7 - 5/6/2020"),
    "1.4.8 - 12.6.2020" : MessageLookupByLibrary.simpleMessage("1.4.8 - 12/6/2020"),
    "1.4.9 - 16.6.2020" : MessageLookupByLibrary.simpleMessage("1.4.9 - 16/6/2020"),
    "10%" : MessageLookupByLibrary.simpleMessage("10%"),
    "10% - 90% der Werte" : MessageLookupByLibrary.simpleMessage("値の10% - 90%"),
    "15 Minuten" : MessageLookupByLibrary.simpleMessage("15 分"),
    "2,1 bis 3,0" : MessageLookupByLibrary.simpleMessage("2,1 ～ 3,0"),
    "2.0.0 - 15.7.2020" : MessageLookupByLibrary.simpleMessage("2.0.0 -2020/7/15"),
    "2.0.1 - 8.9.2020" : MessageLookupByLibrary.simpleMessage("2.0.1 - 8/9/2020"),
    "2.0.10 - 07.11.2021" : MessageLookupByLibrary.simpleMessage("2.0.10 - 07/11/2021"),
    "2.0.11 - 26.11.2021" : MessageLookupByLibrary.simpleMessage("2.0.11 - 26/11/2021"),
    "2.0.12 - 07.12.2021" : MessageLookupByLibrary.simpleMessage("2.0.12 - 07/12/2021"),
    "2.0.2 - 22.9.2020" : MessageLookupByLibrary.simpleMessage("2.0.2 - 22/9/2020"),
    "2.0.3 - 18.10.2020" : MessageLookupByLibrary.simpleMessage("2.0.3 - 18/10/2020"),
    "2.0.4 - 18.02.2021" : MessageLookupByLibrary.simpleMessage("2.0.4 - 18/02/2021"),
    "2.0.5 - 07.03.2021" : MessageLookupByLibrary.simpleMessage("2.0.5 - 07/03/2021"),
    "2.0.6 - 17.03.2021" : MessageLookupByLibrary.simpleMessage("2.0.6 - 17/03/2021"),
    "2.0.7 - 17.04.2021" : MessageLookupByLibrary.simpleMessage("2.0.7 - 17/04/2021"),
    "2.0.8 - 09.06.2021" : MessageLookupByLibrary.simpleMessage("2.0.8 - 06/09/2021"),
    "2.0.9 - 11.08.2021" : MessageLookupByLibrary.simpleMessage("2.0.9 - 11/08/2021"),
    "2.1.0 - 09.12.2021" : MessageLookupByLibrary.simpleMessage("2.1.0 - 09/12/2021"),
    "25%" : MessageLookupByLibrary.simpleMessage("25%"),
    "25% - 75% der Werte" : MessageLookupByLibrary.simpleMessage("値の25% - 75%"),
    "3,1 bis 4,0" : MessageLookupByLibrary.simpleMessage("3,1 ～ 4,0"),
    "30 Minuten" : MessageLookupByLibrary.simpleMessage("30 分"),
    "4,1 bis 4,5" : MessageLookupByLibrary.simpleMessage("4,1 ～ 4,5"),
    "5 Minuten" : MessageLookupByLibrary.simpleMessage("5 分"),
    "75%" : MessageLookupByLibrary.simpleMessage("75%"),
    "90%" : MessageLookupByLibrary.simpleMessage("90%"),
    "<br><br>Wenn diese URL geschützt ist, muss ausserdem der Zugriffsschlüssel korrekt definiert sein. Diesen erreicht man über \"Administrator-Werkzeuge\" auf der persönlichen Nightscout Seite." : MessageLookupByLibrary.simpleMessage("<br> <br> この URL が保護されているなら、アクセス・トークンも正しく定義されている必要があります。これは自分のナイトスカウトのページの「管理ツール」(Admin Tools)から行えます。"),
    "Abbruch" : MessageLookupByLibrary.simpleMessage("キャンセル"),
    "Absturz behoben, der auftrat, wenn kein passendes Profil für einen Zeitpunkt gefunden werden konnte" : MessageLookupByLibrary.simpleMessage("プロファイルが一定時間内に一致しない場合、クラッシュしていた問題が修正されました。"),
    "Acht" : MessageLookupByLibrary.simpleMessage("8"),
    "Alle Benutzer ausgeben" : MessageLookupByLibrary.simpleMessage("すべてのユーザーを表示"),
    "Alle Werte für den Tag anzeigen" : MessageLookupByLibrary.simpleMessage("1日のすべての値を表示"),
    "Alles" : MessageLookupByLibrary.simpleMessage("すべて"),
    "Allgemeines" : MessageLookupByLibrary.simpleMessage("全般"),
    "Als ersten Tag der Woche festlegen" : MessageLookupByLibrary.simpleMessage("週の始まりの曜日を選択"),
    "Ampullenwechsel" : MessageLookupByLibrary.simpleMessage("リザーバー交換"),
    "Anmelden" : MessageLookupByLibrary.simpleMessage("サインイン"),
    "Anmeldung bei Google..." : MessageLookupByLibrary.simpleMessage("Google にサインイン中..."),
    "Anmeldung erfolgreich" : MessageLookupByLibrary.simpleMessage("ログインしました"),
    "Anpas-\nsung" : MessageLookupByLibrary.simpleMessage("調整"),
    "Anzahl Ampullenwechsel" : MessageLookupByLibrary.simpleMessage("リザーバーの交換回数"),
    "Anzahl Katheterwechsel" : MessageLookupByLibrary.simpleMessage("注入場所変更回数"),
    "Anzahl Messungen" : MessageLookupByLibrary.simpleMessage("値数"),
    "Anzahl Sensorenwechsel" : MessageLookupByLibrary.simpleMessage("センサー変更回数"),
    "Anzahl Unterzuckerungen" : MessageLookupByLibrary.simpleMessage("低血糖の回数"),
    "Anzahl der Sensoren zur Analyse hinzugefügt" : MessageLookupByLibrary.simpleMessage("分析へのセンサー数追加"),
    "Anzahl:" : MessageLookupByLibrary.simpleMessage("Count:"),
    "Anzeigeeinstellungen" : MessageLookupByLibrary.simpleMessage("画面設定"),
    "Auf 10be muss beim Server in den Standardeinstellungen der Haken bei \"cors\" aktiviert werden, damit externe Tools wie dieses hier auf die Daten zugreifen dürfen. Wenn \"cors\" aktiviert wurde, muss auf dem Server eventuell noch ReDeploy gemacht werden, bevor es wirklich verfügbar ist." : MessageLookupByLibrary.simpleMessage("10be では、このような外部ツールがデータにアクセスできるよう、サーバ用の初期設定で cors のチェックボックスを有効にしておく必要があります。cors が有効であれば、実際の利用前にサーバー上で ReDeploy を実行する必要があることがあります。"),
    "Auf Kacheln Bilder statt Namen anzeigen" : MessageLookupByLibrary.simpleMessage("タイルに名称ではなくイメージを表示"),
    "Auf dem Einstellungen-Dialog gibt es neben den URL-Eingabefeldern jeweils einen Button, um die URL in einem neuen Browser-Fenster zu öffnen." : MessageLookupByLibrary.simpleMessage("In addition to the URL input fields, there is a button on the Settings dialog to open the URL in a new browser window."),
    "Auf den Kacheln können nun Bilder statt der Namen angezeigt werden. Die Bilder zeigen dann das ungefähre Aussehen der entsprechenden Seite an. Sie entsprechen nicht den tatsächlichen Daten, sondern sind nur eine visuelle Darstellung, die es manchem Benutzer vielleicht einfacher machen, die gewünschten Seiten schneller auszuwählen. Die Aktivierung der Bilder erfolgt im Einstellungsdialog." : MessageLookupByLibrary.simpleMessage("名前の代わりにタイル上に画像を表示できるようになりました。画像は、対応するページのおおまかな表示です。実際のデータではありませんが、視覚的な表示であるため、一部の利用者は望むページを手短に選択しやすくなるでしょう。画像の有効化は設定ダイアログから行えます。"),
    "Auf den Seiten Profil und Basalrate wird in der Titelzeile jetzt wieder das Datum angezeigt, ab dem das Profil gilt." : MessageLookupByLibrary.simpleMessage("プロファイルの開始日が、プロフィールとベーサルレートのページのタイトルバーに表示されます。"),
    "Auf der Analyseseite kann statt der Anzahl der Werte bei den Zielbereichen jetzt die Standardabweichung der Werte im Zielbereich angezeigt werden." : MessageLookupByLibrary.simpleMessage("分析ページの値の個数の代わりに目標範囲の標準偏差が表示されるようになりました。"),
    "Auf der Analyseseite werden nun auch GVI und PGS ausgegeben." : MessageLookupByLibrary.simpleMessage("分析ページに GVI と PGS を追加しました。"),
    "Auf der Analyseseite wird jetzt auch die Standardabweichung aller Werte der Periode angezeigt." : MessageLookupByLibrary.simpleMessage("分析ページに選択範囲すべての標準偏差も表示されるようになりました。"),
    "Auf der Profilseite wurde die Spalte für die Werte von ICR verbreitert." : MessageLookupByLibrary.simpleMessage("プロファイルページの ICR の列幅を広げました"),
    "Auf der Seite \"Profil\" wird die Gültigkeit jetzt mit Uhrzeit angezeigt." : MessageLookupByLibrary.simpleMessage("プロファイルページで、validity (未訳) が時間と共に表示されます。"),
    "Auf der Seite \"Stündliche Statistik\" gibt es eine neue Option, um auch Spalten mit 10% und 90% anzeigen zu lassen." : MessageLookupByLibrary.simpleMessage("「毎時統計」ページに新しいオプションが追加され、10％ と 90％ の列も表示できます。"),
    "Auf der Seite Protokoll werden jetzt auch Insulinabgaben angezeigt, die z.B. über xdrip eingegeben wurden." : MessageLookupByLibrary.simpleMessage("Iインスリンデリバリーはプロトコルページにも表示されるようになりました。例) xdrip経由で入力された場合など"),
    "Aufhebung von temp. Ziel" : MessageLookupByLibrary.simpleMessage("Cancel temp target"),
    "Aufsummierte Werte" : MessageLookupByLibrary.simpleMessage("合計値"),
    "Aus den Profilen ermitteln" : MessageLookupByLibrary.simpleMessage("プロファイルから抽出"),
    "Ausgabe" : MessageLookupByLibrary.simpleMessage("出力"),
    "Ausgabe Parameter" : MessageLookupByLibrary.simpleMessage("出力パラメータ"),
    "Ausgewertete Tage" : MessageLookupByLibrary.simpleMessage("評価期間"),
    "Ausgewählter Zeitraum" : MessageLookupByLibrary.simpleMessage("期間を選択"),
    "Ausrichtung" : MessageLookupByLibrary.simpleMessage("方向"),
    "Auswertung" : MessageLookupByLibrary.simpleMessage("分析"),
    "Automatisch" : MessageLookupByLibrary.simpleMessage("自動"),
    "Automatisch_theme selection - automatic" : MessageLookupByLibrary.simpleMessage("自動"),
    "Basal" : MessageLookupByLibrary.simpleMessage("ベーサル"),
    "Basal 0%" : MessageLookupByLibrary.simpleMessage("基礎 0%"),
    "Basal aus Profil anzeigen" : MessageLookupByLibrary.simpleMessage("プロファイルから基礎を表示"),
    "Basal ges." : MessageLookupByLibrary.simpleMessage("総基礎量"),
    "Basal mit zwei Nachkommastellen" : MessageLookupByLibrary.simpleMessage("ベーサルレート：小数点以下表示"),
    "Basalrate" : MessageLookupByLibrary.simpleMessage("ベーサルレート"),
    "Basalrate\nIE / Stunde" : MessageLookupByLibrary.simpleMessage("ベーサルレート U / hr"),
    "Basalrate anzeigen" : MessageLookupByLibrary.simpleMessage("ベーサルレートを表示"),
    "Batteriewechsel" : MessageLookupByLibrary.simpleMessage("電池交換"),
    "Behandlungen" : MessageLookupByLibrary.simpleMessage("処置"),
    "Bei 0 beginnen" : MessageLookupByLibrary.simpleMessage("Start with 0"),
    "Bei Herokuapp und anderen Anbietern kostenloser Datenbankinstanzen ist der Speicherplatz der Instanz beschränkt, weshalb sie irgendwann voll ist. Dann kann man zwar eine neue Instanz anlegen, Nightscout Reporter benötigt aber für eine lückenlose Darstellung aller Tage Zugriff auf alle Instanzen, für die man eine Auswertung erhalten will. Deshalb können nun mehrere URLs für die Nightscout Instanzen eingegeben werden. Zusätzlich muss noch eingegeben werden, welches der erste und der letzte Tag mit Daten ist. Mit diesen Informationen ist es Nightscout Reporter dann möglich die benötigten Daten lückenlos auch über mehrere Instanzen hinweg auszuwerten." : MessageLookupByLibrary.simpleMessage("With herokuapp and other providers of free database instances, the instance\'s storage space is limited, which is why it becomes full at some point. Then you can create a new instance, but Nightscout Reporter needs access to all instances for which you want to receive a PDF in order to be able to display it seamlessly every day. Therefore, multiple URLs can now be entered for the Nightscout instances. In addition, you have to enter which is the first and the last day with data. With this information, Nightscout Reporter can then seamlessly evaluate the required data across multiple instances."),
    "Bei Tagesgrafiken und Wochengrafiken gibt es jetzt die Möglichkeit 1, 2, 4, 8 oder 16 Grafiken auf einer Seite zu platzieren." : MessageLookupByLibrary.simpleMessage("デイリーグラフとウィークリーグラフで1枚のPDFに複数の画像を表示できるようになりました。（1枚・2枚・4枚・8枚・16枚）"),
    "Bei den Ausgabeparametern kann jetzt festgelegt werden, in welcher Einheit die Glukosemessungen ausgegeben werden sollen. Diese wird zu Beginn aus den in Nightscout gespeicherten Daten ermittelt und entsprechend vorbelegt. Es ist aber auch möglich, diese Einheit zu ändern oder beide Einheiten ausgeben zu lassen. Wenn beide ausgegeben werden, dann wird jedes Formular auf dem Glukoseangaben vorhanden sind zunächst mit mg/dL und danach nochmal mit mmol/l ausgegeben. Diese Einheit wird auch in den Shortcuts gespeichert." : MessageLookupByLibrary.simpleMessage("In the output parameters, you can now specify the unit in which the glucose values are to be shown. At the beginning this is determined from the data stored in Nightscout and pre-assigned accordingly. But it is also possible to change this unit or to have both units shown. If \"both\" is selected, then every form on which glucose information is available is shown first with mg/dL and then again with mmol/l. This unit is also saved in the shortcuts."),
    "Bei der Auswertung kann nun ein Bereich angezeigt werden, in dem die Anzahl an Unterzuckerungen während des ausgewählten Zeitraums und der Zeitpunkt der letzten Unterzuckerung angezeigt werden." : MessageLookupByLibrary.simpleMessage("解析で、選択期間中の低血糖の数と最後の低血糖の時間が表示できます。"),
    "Bei der Basalrate und dem Profil gibt es nun eine Option jeweils nur das letzte im entsprechenden Zeitraum ausgeben zu lassen. Das verringert die Blätterflut bei häufigem Profilwechsel." : MessageLookupByLibrary.simpleMessage("ベーサルレートとプロファイルにおいて、対応期間中の最後のものだけを印刷するオプションが利用できます。これにより頻繁にプロファイルが更新されるページを減らせます。"),
    "Bei der Berechnung der Kohlenhydrate werden weitere Datensätze berücksichtigt" : MessageLookupByLibrary.simpleMessage("追加データは炭水化物の計算に利用されます"),
    "Bei der Festlegung des Zeitraums kann man jetzt angeben, bis zu welchem Tag der Zeitraum ermittelt werden soll. Voreingestellt ist so wie bisher auch der aktuelle Tag. Man kann aber auch den gestrigen Tag einstellen, um Tage mit vollständigen Daten zu haben, oder das letzte Wochenende, wenn man an vollständigen Wochen interessiert ist." : MessageLookupByLibrary.simpleMessage("When defining the period, you can now specify up to which day the period should be determined. As before, the current day is preset. You can also set yesterday to have days with complete dates, or the last weekend if you are interested in complete weeks."),
    "Bei der Profilermittlung wurde manchmal der letzte Profilwechsel ignoriert. Das ist nun behoben." : MessageLookupByLibrary.simpleMessage("The last profile change was sometimes ignored when determining the profile. That is now fixed."),
    "Beide" : MessageLookupByLibrary.simpleMessage("Both"),
    "Beim Auslesen der Profile ist ein Fehler aufgetreten. Möglicherweise sind zu viele Daten in der Profiltabelle (wird z.B. von iOS Loop verursacht). Du kannst versuchen, in den Einstellungen die Anzahl an auszulesenden Profildatensätzen zu verringern." : MessageLookupByLibrary.simpleMessage("An error occurred while reading out the profiles. There may be too much data in the profile table (e.g. caused by iOS Loop). You can try to reduce the number of profile data records to be read in the settings."),
    "Beim CGP werden die aktuellen Werte jetzt in der Legende angezeigt." : MessageLookupByLibrary.simpleMessage("CGP では、現在の値が凡例に表示されるようになりました。"),
    "Beim Erzeugen des PDF ist ein Fehler aufgetreten." : MessageLookupByLibrary.simpleMessage("PDF作成中にエラーが発生しました。"),
    "Beim Glukose Perzentil Diagramm kann man nun ein Maximum für die Skalierung festlegen. Wenn es auf \"Automatisch\" gesetzt wird, wird das Maximum wie bisher auch ermittelt. Bei einem anderen Wert wird die Obergrenze für das Diagramm auf diesen Wert festgesetzt. Damit ist es leichter möglich zwei Diagramme miteinander zu vergleichen, deren Obergrenze unterschiedlich ist." : MessageLookupByLibrary.simpleMessage("グルコースパーセンタイル図表で、縮尺の最大値が設定できます。「自動」に設定されていれば、以前と同様に最大値が決定されます。それ以外の値では、図表の上限がこの値に設定されます。これにより、上限値の異なる2つの図表が比較しやすくなりました。"),
    "Beim Laden der Behandlungsdaten werden doppelte Datensätze herausgefiltert." : MessageLookupByLibrary.simpleMessage("処置データが読み込まれると、重複するデータレコードはフィルタリングされます。"),
    "Beim Laden der Daten wird das entsprechende Datumsformat zur Anzeige verwendet" : MessageLookupByLibrary.simpleMessage("データのロード中は、対応する日付形式が進行状況の表示に使用されます。"),
    "Beim Perzentil Diagramm gibt es eine neue Option, mit der man die Basalrate unter dem Diagramm anzeigen lassen kann. Da das Diagramm normalerweise einen grösseren Zeitraum umspannt, wird dort die Basalrate angezeigt, die zu Beginn des Zeitraums aktiv war." : MessageLookupByLibrary.simpleMessage("血糖値変動パターンの新しいオプションでは、基礎単位をその図表下に表示できます。この図表は通常より長い期間が表示されるため、その期間の最初にアクティブだったベーサルレートが表示されます。"),
    "Beim erstmaligen Start von Nightscout Reporter wurde er schon bei Sprachänderung normal angezeigt. Jetzt bleibt er wie vorgesehen auf dem Willkommen Dialog." : MessageLookupByLibrary.simpleMessage("When Nightscout Reporter was started for the first time, it was displayed normally when the language changed. Now it stays on the welcome dialog as intended."),
    "Benutzer können ein User-Token angeben, um sich mit geschützten Nightscout-Instanzen zu verbinden" : MessageLookupByLibrary.simpleMessage("保護されたナイトスカウトのプログラムに接続するためにユーザー・トークンを設定できます"),
    "Benutzer können nun gelöscht werden" : MessageLookupByLibrary.simpleMessage("利用者を削除可能になりました。"),
    "Benutzerdaten" : MessageLookupByLibrary.simpleMessage("利用者情報"),
    "Benutzerdaten werden nun verschlüsselt im Browser gespeichert" : MessageLookupByLibrary.simpleMessage("利用者の情報は、ブラウザに暗号化されて保存されるようになりました。"),
    "Berechnete IE für Kohlenhydrate" : MessageLookupByLibrary.simpleMessage("炭水化物より算出したインスリン量（U）"),
    "Berechnete IE für Kohlenhydrate anzeigen" : MessageLookupByLibrary.simpleMessage("炭水化物量から算出したインスリン量を表示"),
    "Bereite Daten vor..." : MessageLookupByLibrary.simpleMessage("データを準備中…"),
    "Bestätigung" : MessageLookupByLibrary.simpleMessage("確認"),
    "Bewegung" : MessageLookupByLibrary.simpleMessage("運動"),
    "Bewegung anzeigen" : MessageLookupByLibrary.simpleMessage("運動を表示"),
    "Bezeichnung" : MessageLookupByLibrary.simpleMessage("タイトル"),
    "Bis" : MessageLookupByLibrary.simpleMessage("～"),
    "Bis heute|Bis gestern|Bis Wochenende" : MessageLookupByLibrary.simpleMessage("Til Today|Til Yesterday|Til Weekend"),
    "Bisher fehlende Summenwerte in der Tagesstatistik hinzugefügt" : MessageLookupByLibrary.simpleMessage("日別統計に合計を追加しました。"),
    "Bitte den Dateinamen für die Speicherung auswählen" : MessageLookupByLibrary.simpleMessage("保存するファイル名を選択してください"),
    "Bitte einen Zeitraum wählen." : MessageLookupByLibrary.simpleMessage("期間を選択してください"),
    "Bitte überprüfe die Aktivierung der Wochentage unter dem Monat" : MessageLookupByLibrary.simpleMessage("カレンダーの下にあるチェック印を確認してください"),
    "Blutige Messung" : MessageLookupByLibrary.simpleMessage("血糖値"),
    "Blutige Werte sollten jetzt auch bei mmol-Daten korrekt in der Tagesgrafik angezeigt werden." : MessageLookupByLibrary.simpleMessage("デイリーグラフの mmol データの Bloody values が正しく表示されるようになりました。"),
    "Blutwerte werden jetzt auch bei mmol/L in den Grafiken korrekt angezeigt." : MessageLookupByLibrary.simpleMessage("血糖値が mmol/l でグラフに正しく表示できるようになりました。"),
    "Bolus" : MessageLookupByLibrary.simpleMessage("ボーラス"),
    "Bolus Rechner_bolus calculated by the bolus wizard" : MessageLookupByLibrary.simpleMessage("ボーラスウィザード"),
    "Bolus ges." : MessageLookupByLibrary.simpleMessage("ボーラス合計"),
    "Bolusarten anzeigen" : MessageLookupByLibrary.simpleMessage("ボーラスの種類を表示"),
    "Bolusspalte anzeigen" : MessageLookupByLibrary.simpleMessage("ボーラスの列を表示"),
    "CGP" : MessageLookupByLibrary.simpleMessage("CGP"),
    "CGP immer mit Standard Zielbereich" : MessageLookupByLibrary.simpleMessage("CGP always with Standard Targetarea"),
    "COB (Carbs On Board) anzeigen" : MessageLookupByLibrary.simpleMessage("COB (炭水化物 On Board) を表示"),
    "Comprehensive Glucose Pentagon" : MessageLookupByLibrary.simpleMessage("グルコース総合グラフ"),
    "Da wir seit einiger Zeit in Europa eine DSGVO haben, werden im Folgenden noch die Vorschriften dafür erfüllt. Der folgende Text ist nur auf Deutsch verfügbar:" : MessageLookupByLibrary.simpleMessage("以下の文章はヨーロッパの DSGVO に適合しています。またこのテキストはドイツ語のみで利用可能です:"),
    "Dansk" : MessageLookupByLibrary.simpleMessage("Dansk"),
    "Das \"Comprehensive Glucose Pentagon\" (Umfassendes Glukose Fünfeck) wurde als eigenes PDF und als Zusatzseite zur Tagesgrafik und Wochengrafik hinzugefügt. Es handelt sich hierbei um eine Darstellung von fünf Messgrössen, mit deren Hilfe sich die Qualität der Therapie ermitteln und mit anderen vergleichen lässt. Auf den Ausdrucken wird ein Verweis auf die zugrunde liegende Abhandlung ausgegeben." : MessageLookupByLibrary.simpleMessage("「グルコース総合グラフ」を、別の PDF として分割し、また 1日チャートと週間チャートとして別ページに追加しました。このグラフは 5つの指標を表しており、治療の質を決定するのを助けたり、各指標を比較できます。印刷出力では出力している各レポートの追加ページとして出力されます。"),
    "Das Anklicken des Nachrichtenbereichs schliesst diesen nicht mehr." : MessageLookupByLibrary.simpleMessage("メッセージエリアをクリックしても、ページが閉じなくなりました。"),
    "Das CGP wird jetzt auch bei extremen Werten korrekt erzeugt." : MessageLookupByLibrary.simpleMessage("The CGP is now generated correctly even with extreme values."),
    "Das Control für die Eingabe des Zeitraums wurde angepasst, damit es auf schmalen Display auch korrekt dargestellt wird." : MessageLookupByLibrary.simpleMessage("期間選択の選択画面が、狭いディスプレイで正しく表示されるように調整しました。"),
    "Das Enddatum ist nicht korrekt" : MessageLookupByLibrary.simpleMessage("終了日が正しくありません"),
    "Das Logo von Nightscout Reporter wurde geändert. Es ist nach wie vor die bekannte und beliebte Eule, aber sie hat nun eine Mütze auf wie die Zeitungsausträger und teilweise auch Journalisten in uralten Filmen. Das Logo ist nur im Programm vorhanden und erscheint nicht auf den PDFs. Dort ist nach wie vor das normale Nightscout Logo, weil es dort platziert wurde, um auf Nightscout selbst hinzuweisen." : MessageLookupByLibrary.simpleMessage("The Nightscout Reporter logo has been changed. It is still the well-known and popular owl, but it now wears a hat like the newspaper deliverers and sometimes also journalists in ancient films. The logo is only shown in the program and does not appear on the PDFs. There is still the normal Nightscout logo because it was placed there to refer to Nightscout itself."),
    "Das PDF für die Basalrate war nicht korrekt, wenn nicht für jede Stunde ein Wert vorlag." : MessageLookupByLibrary.simpleMessage("ベーサルレートPDFは、毎時間の値が無い場合は正しく表示できませんでした。"),
    "Das PDF wurde erstellt. Wenn es nicht angezeigt wird, dann ist vermutlich ein Popup-Blocker aktiv, der die Anzeige verhindert. Diesen bitte deaktivieren." : MessageLookupByLibrary.simpleMessage("PDFが作成されました。表示されない場合、ブラウザのポップアップ禁止設定が有効になっている可能性がありますので、ご確認ください。"),
    "Das Problem, dass bestimmte Tage nicht erzeugt werden konnten, wurde behoben." : MessageLookupByLibrary.simpleMessage("特定の日が作成できなかった問題が修正されました。"),
    "Das Profil-PDF wird nun im Querformat erzeugt, um auch Profile mit vielen Einträgen für die Parameter brauchbar darstellen zu können." : MessageLookupByLibrary.simpleMessage("パラメータのエントリーが多いプロファイルでも PDF が横長で出力され表示できるようになりました。"),
    "Das Projekt wurde auf Dart 2.13.4 und Angular 6.0.1 aktualisiert." : MessageLookupByLibrary.simpleMessage("The project was updated to Dart 2.13.4 and Angular 6.0.1."),
    "Das Startdatum ist nicht korrekt" : MessageLookupByLibrary.simpleMessage("開始日が正しくありません"),
    "Das gelbe Fünfeck stellt den Wertebereich des angegebenen Zeitraums dar." : MessageLookupByLibrary.simpleMessage("黄色の五角形は、選択期間の値を表しています"),
    "Das grüne Fünfeck stellt den Wertebereich eines gesunden Menschen ohne Diabetes dar." : MessageLookupByLibrary.simpleMessage("緑色の五角形の範囲は、糖尿病ではない人の値を表しています"),
    "Daten bis" : MessageLookupByLibrary.simpleMessage("Data to"),
    "Daten für die Glukosewerte mit fehlerhaftem Datumsformat werden jetzt trotzdem korrekt ausgelesen." : MessageLookupByLibrary.simpleMessage("間違っている血糖値と日付形式のデータも正しく読み込めます。"),
    "Daten verschiedener Uploader werden nun besser interpretiert." : MessageLookupByLibrary.simpleMessage("異なるアップローダーからのデータを正確に処理できるようになりました。"),
    "Daten von" : MessageLookupByLibrary.simpleMessage("Data from"),
    "Daten, die von xDrip als sync markiert wurden, werden bei der Auswertung ignoriert." : MessageLookupByLibrary.simpleMessage("xDripより同期されたデータは計算時に無視されます。"),
    "Datenschutzerklärung" : MessageLookupByLibrary.simpleMessage("情報保護"),
    "Datum" : MessageLookupByLibrary.simpleMessage("日付"),
    "Dauer der Insulinaktivität (DIA)" : MessageLookupByLibrary.simpleMessage("インスリン作用時間(DIA)"),
    "Dauer der Kohlenhydrataktivität" : MessageLookupByLibrary.simpleMessage("炭水化物作用時間"),
    "Dauer der abgeschalteten Basalrate anzeigen" : MessageLookupByLibrary.simpleMessage("無効化されたベーサルレートの期間を表示"),
    "Dauer mit Minutenbruchteil" : MessageLookupByLibrary.simpleMessage("正確な期間"),
    "Der Fehler im Profil, der dazu führte, dass die Werte für ISF und Zielbereich falsch umgerechnet werden, wurde behoben." : MessageLookupByLibrary.simpleMessage("プロフィールの ISF と目標範囲の値が正確に変換されないバグを修正しました。"),
    "Der Fehler mit der Vervielfachung der Kohlenhydrate bei wiederholter Ausgabe der PDFs wurde korrigiert." : MessageLookupByLibrary.simpleMessage("PDF の繰り返しの出力での炭水化物の乗算に関するエラーが修正されました。"),
    "Der Titel vom Glucose Percentil Diagramm wird nun auch bei Ausdruck im Hochformat nicht mehr falsch in den Optionen Formularauswahl dargestellt." : MessageLookupByLibrary.simpleMessage("The title of the Glucose Percentile Diagram is no longer displayed incorrectly in the form selection options when printing in portrait format."),
    "Der Zeitraum enthält keine auswertbaren Tage" : MessageLookupByLibrary.simpleMessage("選択した期間に表示できる日が含まれていません"),
    "Der prognostische glykämische Risikoparameter stellt das Risiko von Langzeitkomplikationen dar (bisher nicht durch Studien belegt)." : MessageLookupByLibrary.simpleMessage("予後血糖リスクパラメーターは、長期的な合併症のリスクを表します (これまでの研究で証明されてはいません)。"),
    "Details des Profilwechsels" : MessageLookupByLibrary.simpleMessage("プロファイル変更の詳細"),
    "Deutsch" : MessageLookupByLibrary.simpleMessage("ドイツ語"),
    "Diabetes seit" : MessageLookupByLibrary.simpleMessage("糖尿病歴"),
    "Dialoge und die Anzeige des Fortschritts werden nun technisch etwas anders umgesetzt. Deswegen wird der Anwendungshintergrund nun in den Fällen dunkler dargestellt und es ist nicht möglich darauf etwas anzuklicken." : MessageLookupByLibrary.simpleMessage("Dialogs and the display of the progress are now implemented a little different technically. Because of this, the application background is now shown darker in the cases and it is not possible to click on anything."),
    "Die Analyse-Seite wurde überarbeitet und zeigt nun Überschriften über den Bereichen an" : MessageLookupByLibrary.simpleMessage("分析ページ上部に見出しが表示されるようにデザインを変更しました。"),
    "Die Analysewerte wurden nicht ganz korrekt ermittelt. Das wurde korrigiert und nun sollten die statistischen Daten über den Zeitraum richtig ausgewertet werden." : MessageLookupByLibrary.simpleMessage("分析値が正しく決定されていませんでした。これが修正され、指定期間中に評価される統計データは正されるでしょう。"),
    "Die Angabe DIA auf der Profilseite wird nun mit zwei Nachkommastellen angezeigt." : MessageLookupByLibrary.simpleMessage("プロフィールのインスリン作用時間は、小数点以下2桁で表示されるようになりました。"),
    "Die Anzeige der Bilder auf Kacheln wird nun wie vorgesehen korrekt in den Einstellungen vorbelegt." : MessageLookupByLibrary.simpleMessage("The display of the images on tiles is now correctly preset in the settings as intended."),
    "Die Aufsummierung der Werte in der Analyse wurde korrigiert." : MessageLookupByLibrary.simpleMessage("解析内の値の蓄積を修正しました。"),
    "Die Aufteilung auf mehrere PDF-Dateien funktioniert jetzt besser." : MessageLookupByLibrary.simpleMessage("PDF ファイルの複数分割が改善されました。"),
    "Die Ausgabe des Zielwertes und der blutigen Werte in der Tagesgrafik wurde korrigiert. Da gab es Probleme, wenn man eine andere Blutzucker Einheit als die auf dem Server eingestellte zur Ausgabe verwendet hat." : MessageLookupByLibrary.simpleMessage("The output of the target value and the blood values in the daily graphic has been corrected. There were problems when a different blood sugar unit than the one set on the server was used for output."),
    "Die Auswahl des Zeitraums ist nun flexibler. Die Auswahl erfolgt in einem Dialog, der die eingestellte Sprache berücksichtigt. Mit der Auswahl der vorbelegten Bereiche (Heute, Letzte Woche, usw.) wird festgelegt, dass beim nächsten Aufruf das aktuelle Datum als Grundlage für den Bereich verwendet wird. Wenn der Bereich direkt im Kalender festgelegt wird, dann gilt dieser beim nächsten Aufruf so wie er festgelegt wurde. Standardmässig ist der erste Tag der Woche jetzt ein Montag. Dieser kann aber durch Anklicken des Wochentags in der Titelzeile des Monats auf die eigene Präferenz festgelegt werden. Die Eingabe der Datumsfelder erfolgt in der Form, die der Sprache entspricht (Tag.Monat.Jahr für deutsch, Monat/Tag/Jahr für englisch)." : MessageLookupByLibrary.simpleMessage("期間の選択がより自由になりました。選択は、言語を考慮したダイアログで行われます。規定の範囲（本日、先週等）を選択すると現在の日付が次の設定での基準日として設定されます。範囲をカレンダーで直接設定している場合は、設定に従って定義されます。又、デフォルトでは週の始まりは月曜日ですが、タイトルバーの曜日をクリックする事で変更が可能です。日付フィールドは言語に対応するフォーマットで入力されます。(ドイツ語：日/月/年　英語：月/日/年)"),
    "Die Auswahl des Zeitraums und der Benutzer wurde in die Titelzeile verschoben." : MessageLookupByLibrary.simpleMessage("タイトルバーに期間とユーザーの選択が移動されました。"),
    "Die Balken für das Bolusinsulin in der Tagesgrafik werden nun entsprechend dem Maximalwert an Bolusinsulin an dem Tag skaliert." : MessageLookupByLibrary.simpleMessage("デイリーグラフのボーラスバーは、その日の最大ボーラスによって縮尺が決定されます。"),
    "Die Balken in der Analyse werden jetzt korrekt skaliert." : MessageLookupByLibrary.simpleMessage("分析のバーが正しく縮尺されます。"),
    "Die Basalratenprofile für den Tag werden nun auch anhand der Behandlungsdaten ermittelt. Profilwechsel werden in der Tagesgrafik angezeigt und sollten ab dem Zeitpunkt des Wechsels auch eine korrekte Basalratenanpassung anzeigen." : MessageLookupByLibrary.simpleMessage("その日の基礎レートのプロファイルも処置データに基づき決定されるようになりました。プロファイルの変更はデイリーグラフに表示され、変化した瞬間に調整され正しい基礎単位が表示されます。"),
    "Die Berechnung der PDF-Grössen wurde korrigiert, so dass nun weniger PDFs erstellt werden, wenn sie aufgrund der Grösse aufgeteilt werden." : MessageLookupByLibrary.simpleMessage("PDF のサイズ計算を修正しました。サイズにより分割する際の PDF の数が少なくなりました。"),
    "Die Berechnung der Summenzeile auf der Seite Tagesstatistik wurde korrigiert." : MessageLookupByLibrary.simpleMessage("日別統計の合計行の計算を修正しました。"),
    "Die Berechnung der tatsächlichen Basalrate wurde korrigiert." : MessageLookupByLibrary.simpleMessage("実際のベーサルレートの計算式を修正しました。"),
    "Die Berechnung des täglichen Insulins berücksichtigt nun auch die SMB." : MessageLookupByLibrary.simpleMessage("SMB が1日のインスリン量にも考慮されるようになりました。"),
    "Die Bilder auf den Kacheln sind nun in der jeweiligen Sprache beschriftet." : MessageLookupByLibrary.simpleMessage("タイルの画像が各言語でラベル付けされます。"),
    "Die Buttons für die Erzeugung vergangener Zeiträume wurden entfernt. Das kann jetzt im neuen PDF-Dialog eingestellt werden." : MessageLookupByLibrary.simpleMessage("以前の期間を作成ボタンが削除されました。これからは、これは新しい PDF ダイアログ内でで設定可能です。"),
    "Die Buttons für die vergangenen Perioden werden nicht angezeigt, wenn kein Zeitraum oder kein PDF ausgewählt wurde." : MessageLookupByLibrary.simpleMessage("期間や PDF が選択されていない場合、過去の期間ボタンは表示されません。"),
    "Die Daten, die Du hier eingibst, werden normalerweise im localStorage des Browsers gespeichert. Dieser beinhaltet webseitenbezogene Daten, die nur von dieser Webseite ausgelesen werden können. In diesem Fall werden keine Cookies verwendet und es werden keine Daten auf Servern gespeichert. Es wird lediglich eine Verbindung zur angegebenen Nightscout-Instanz aufgebaut und die dort vorhandenen Daten ausgelesen, um daraus ein PDF-Dokument zu erzeugen. Dieses kann dann dem Diabetesberater oder sonstigen Interessenten vorgelegt werden." : MessageLookupByLibrary.simpleMessage("あなたが入力したデータは、当ページからのみ読み込みが可能でブラウザのローカルストレージに保存されます。これにはサイトでしか読み込めないデータが含まれます。データはサーバーに保存されずクッキーも使用しません。指定したナイトスカウトのプログラムのみが接続されデータを読み込みPDFを作成します。PDFを利用して糖尿病に対する助言者や医療関係者に提出できる場合があります。（※医療関係者に提出する場合は、関係機関にご相談ください）"),
    "Die Eingabe des Zugriffsschlüssels auf dem Einstellungen-Dialog kann jetzt mit einem Button neben dem Eingabefeld lesbar gemacht werden." : MessageLookupByLibrary.simpleMessage("The entry of the access key in the settings dialog can now be made readable with a button next to the input field."),
    "Die Einstellung für das Öffnen des PDF im gleichen Fenster, das Herunterladen des PDFs und den Hinweis auf Nightscout im PDF wurde aus den Einstellungen in die Ausgabe Parameter verschoben. Dadurch kann man das bei jedem Ausdruck schnell festlegen und ändern." : MessageLookupByLibrary.simpleMessage("The setting for opening the PDF in the same window, downloading the PDF and hiding text about Nightscout in the PDF has been moved from the settings to the output parameters. This allows you to quickly set and change that for each output."),
    "Die Einstellungen für das Herunterladen des PDFs, das Öffnen im gleichen Fenster und die Maximalgrösse der PDFs wurden von der Synchronisierung mit Google Drive ausgenommen, weil sie speziell für den verwendeten Browser oder das verwendete Gerät benötigt werden. Sie werden nach wie vor gespeichert, aber sie werden nicht zwischen verschiedenen Browsern synchronisiert." : MessageLookupByLibrary.simpleMessage("PDF のダウンロード、同じウィンドウで PDF を開く、また、 PDF の最大サイズの設定は、使用しているブラウザや端末固有の設定であるため、Google ドライブとの同期から除外されました。これはまだ保存されていますが、異なるブラウザ間では同期されません。"),
    "Die Einträge im Protokoll für temporäre Ziele werden jetzt auch bei mmol-Angaben richtig angezeigt." : MessageLookupByLibrary.simpleMessage("mmol データでも一時的対象のログの項目が正しく表示されます。"),
    "Die Ermittlung der Einheit (mg/dl oder mmol/l) wird nun flexibler gehandhabt, so dass auch Leerzeichen in der entsprechenden Einstellung nicht mehr zu einer Fehlinterpretation führen." : MessageLookupByLibrary.simpleMessage("単位 (mg/dl や mmol/l) の決定が柔軟に対応できるようになりました。設定にスペースが入っている場合でも間違える事がなくなりました。"),
    "Die Ermittlung der effektiven täglichen Basalrate wurde umstrukturiert und sollte nun genauere Werte ergeben." : MessageLookupByLibrary.simpleMessage("1日のベーサルレートの決定が再構成され、より正確な値を得ることができます。"),
    "Die Farbe für Bewegung in der Tagesgrafik wurde geändert." : MessageLookupByLibrary.simpleMessage("デイリーグラフの運動の色を変更。"),
    "Die Farben für Dialoge und Scrollbars wurden angepasst." : MessageLookupByLibrary.simpleMessage("ダイアログとスクロールバーの色を調整しました。"),
    "Die Farben für die Glukosebereiche werden jetzt dort, wo sie als Hintergrundfarbe mit Text verwendet werden heller dargestellt, um die Lesbarkeit zu erhöhen." : MessageLookupByLibrary.simpleMessage("The colors for the glucose areas are now displayed lighter where they are used as a background color with text to make them easier to read."),
    "Die Genauigkeit der ISF Angaben im Profil wurde korrigiert." : MessageLookupByLibrary.simpleMessage("プロファイルの ISF の精度を修正しました。"),
    "Die Genauigkeit der Insulindosierung wird aus dem Profil ermittelt. Der Wert mit der höchsten Genauigkeit legt fest, mit wieviel Nachkommastellen Basalratenwerte angezeigt werden." : MessageLookupByLibrary.simpleMessage("正確なインスリン投与量はプロフィールより決定されます。正確な値はベーサルレートの小数点以下の桁数を決定します。"),
    "Die Glucose Perzentil Grafik wurde um die Tabelle \"Stündliche Statistik\" erweitert. Diese listet tabellarisch die Werte des Zeitraums für jede Stunde des Tages auf. Man kann entweder nur die Grafik, nur die Tabelle oder beides zusammen erzeugen lassen." : MessageLookupByLibrary.simpleMessage("ブドウ糖のパーセンタイル図に、毎時統計の表が追加されました。その日のそれぞれの1時間の値を集計します。図だけ、表だけ、または両方を作成することができます。"),
    "Die Glukosekurve der täglichen Grafiken wurde von fehlenden Daten befreit." : MessageLookupByLibrary.simpleMessage("デイリーグラフ中の血糖値曲線は測定値が欠損している場合も適切に表示できます。"),
    "Die Icons auf einigen Buttons waren zu nahe am Text" : MessageLookupByLibrary.simpleMessage("テキストに近すぎる場所にあった一部のアイコンを修正しました。"),
    "Die Kohlenhydratangaben auf der Tagesgrafik werden jetzt ohne den Zusatz KH ausgegeben." : MessageLookupByLibrary.simpleMessage("デイリーグラフ上の炭水化物に接頭語のKHなしで表示されるようになりました。"),
    "Die Legende der Tagesgrafik wurde um den Eintrag für Bewegung erweitert." : MessageLookupByLibrary.simpleMessage("デイリーグラフのレジェンド要素が拡張され、運動の項目が追加されました。"),
    "Die Legende der Tagesgrafik wurde um den Eintrag für blutige Messungen erweitert." : MessageLookupByLibrary.simpleMessage("デイリーグラフィックの凡例には、血液値のエントリが含まれています"),
    "Die Links zu Nightscout und den Reports von Nightscout im Menü funktionieren jetzt auch richtig, wenn ein Usertoken angegeben wurde." : MessageLookupByLibrary.simpleMessage("ナイトスカウトとナイトスカウトレポートのリンクがユーザー・トークンを設定すると動作するようになりました。"),
    "Die Listenansicht ist jetzt wieder scrollbar." : MessageLookupByLibrary.simpleMessage("リストビューで再びスクロール可能になりました。"),
    "Die Microboli des Minimed 600 Uploaders werden jetzt auch ermittelt und in der Analyse ausgegeben, wenn sie vorhanden sind." : MessageLookupByLibrary.simpleMessage("解析には、Minimed600 シリーズアップローダーのマイクロボーラスも表示されます。"),
    "Die Microboli vom Minimed 600 Uploader wurden aus der Ausgabe entfernt, da es sich dabei nur um Temporäre Basalraten handelt." : MessageLookupByLibrary.simpleMessage("Minimed 600 Uploader からのマイクロボリは、一時的なベーサルレートに過ぎないため、出力から削除されました。"),
    "Die Mischung von zwei Seiten auf einer PDF-Seite, die manchmal vorkam, wurde behoben." : MessageLookupByLibrary.simpleMessage("1つの PDF ページに2ページ混在することがありましたが修正しました。"),
    "Die Möglichkeit für Beta-Funktionen wurde entfernt; die Betaversion ist nun hier zu finden:" : MessageLookupByLibrary.simpleMessage("ベータ機能の予定は削除されました。ベータバージョンは現在こちらから利用可能です。："),
    "Die Möglichkeit, die URL in der Titelzeile anzeigen zu lassen wurde entfernt, da jetzt der aktuelle Benutzer oder dessen URL direkt angezeigt wird" : MessageLookupByLibrary.simpleMessage("ユーザー名とユーザーのURLが直接表示されるようになった為、タイトルバーにURLを表示する機能は削除されました。"),
    "Die Oberfläche kann jetzt verschiedene Darstellungen annehmen. Diese zeigen sich zur Zeit durch geänderte Farben und ein angepasstes Icon im Browsertab und beim Laden der Seite. Das hat keine Auswirkungen auf die erzeugten PDF-Dateien. Es ist die Vorbereitung für eine teilweise anpassbare Oberfläche. Das Thema der Darstellung wird standardmässig vom System festgelegt, was zur Zeit heisst, dass im Dezember ein weihnachtliches Thema angezeigt wird. Das kann aber durch Anklicken des Icons, das ab jetzt links unten zu sehen ist, geändert werden. Beim Anklicken wird rechts neben dem Icon ein Bereich mit den verfügbaren Darstellungen eingeblendet. Das erste Icon (der kleine Zauberer) bedeutet dabei, dass die Darstellung vom System ermittelt wird. Zur Zeit bedeutet das die weihnachtliche Darstellung im Dezember. Es kann in Zukunft aber auch weitere Kriterien geben, anhand derer das Thema angepasst wird. Die direkte Festlegung eines Themas mit einem der anderen icons hat aber immer Vorrang vor der systemeigenen Logik." : MessageLookupByLibrary.simpleMessage("UI において異なる表示を想定するようにしました。現在、異なる色と対応したアイコンで表示されています (仮翻訳)  in the Browser tab and with the loading of the side. これは生成された PDF ファイルには影響しません。これは部分的にカスタマイズできる表示のための準備です。UI のテーマはシステムによってデフォルトで設定されています。12月現在はクリスマスのテーマが表示されるということです。しかし、左下のアイコンをクリックすることで、これを変更可能です。このクリックにより、アイコンの右側に使用できるテーマが表示されます。最初のアイコン (the little wizard) は、システムがテーマを決めているという意味です。12月現在ではクリスマスの presentation ということです。しかし、テーマを調整するための他の基準が、将来的に存在するかもしれません。ただし、one of the (未訳)  他のアイコンのあるテーマの直接的な定義は、システムの論理よりも常に優先されます。"),
    "Die Positionierung der Notizen in der Tagesgrafik wurde korrigiert, so dass sie näher an der Uhrzeit stehen. Die Striche wurden so verkürzt, dass sie nur noch bis zum unteren Rand der Grafik gehen und nicht mehr durch die Wertetabelle." : MessageLookupByLibrary.simpleMessage("デイリーグラフのポンプ履歴の表示位置は、時間近くに表示されるように修正しました。短くグラフの下部に表示し、値と重なりません。"),
    "Die Profilbasalrate im Formular Tagesprofil wird jetzt ebenfalls mit Balken dargestellt." : MessageLookupByLibrary.simpleMessage("The profile basal rate in the daily profile form is now also displayed with bars."),
    "Die Profile für den Zeitraum wurden teilweise nicht korrekt identifiziert. Das sollte behoben sein." : MessageLookupByLibrary.simpleMessage("期間用のプロファイルが部分的に誤って認識されていました。修正の必要があります。"),
    "Die Profilseite wurde angepasst, damit Einträge für 24 Stunden auf eine Seite passen." : MessageLookupByLibrary.simpleMessage("プロファイルのページでは 24 時間の項目が 1ページに収まるように調整されています。"),
    "Die Profiltabelle sollte normalerweise nur Daten zu den verwendeten Profilen beinhalten. iOS Loop verwendet diese Tabelle aber dazu, um dort eigene Einstellungen zu speichern und tut dies bei einigen Benutzern exzessiv. Ab einer bestimmten Datenmenge kann die Profiltabelle über die API dann nicht mehr korrekt abgefragt werden. Deswegen gibt es hier die Möglichkeit, die Anzahl an Datensätzen einzuschränken, die aus dieser Tabelle geholt werden. Das ist so lange notwendig, wie iOS Loop oder andere Uploader diese Tabelle falsch befüllen.\n\nMaximale Anzahl an Profildatensätzen:" : MessageLookupByLibrary.simpleMessage("The profile table should normally only contain data on the profiles used. iOS Loop uses this table to save its own settings and does this excessively at some users. Above a certain amount of data, the profile table can then no longer be queried correctly via the API. This is why there is this option of restricting the number of data records that are fetched from this table. This is necessary as long as iOS Loop or other uploaders fill this table incorrectly.\n\nMaximum number of profile datasets:"),
    "Die Reihenfolge der Formulare kann nun verändert werden. Dazu einfach das Handle auf der linken Seite des Buttons für das Formular anklicken, festhalten und an die Stelle ziehen, vor der es ausgedruckt werden soll." : MessageLookupByLibrary.simpleMessage("作成する PDF の順序を変更できるようになりました。作成する項目を選択する画面で、項目の左側をクリックしたまま上下のドラッグして任意の場所に移動してください。"),
    "Die Seiten Profil und Basalrate zeigen nun bei einem Profil, das nur temporär während eines Tages aktiv war den Zeitraum an, in dem es aktiv war." : MessageLookupByLibrary.simpleMessage("一時的に設定した１日間のプロフィールとベーサルレートは、この期間だけを別ページで表示するようになりました。"),
    "Die Seitenzahlen auf den Kacheln wurden weiter an den unteren Rand verschoben, damit sie immer gut lesbar sind." : MessageLookupByLibrary.simpleMessage("タイルのページ番号をより下に移動し、いつでも読みやすくなりました。"),
    "Die Skalen an den Grafiken wurden überarbeitet. Sie zeigen jetzt für mmol/L ganzzahlige Werte an und die Einheiten wurden entfernt. Diese stehen nur noch unten an der Grafik. Das betrifft die täglichen Grafiken, wöchentlichen Grafiken und das Glukose Percentil Diagramm." : MessageLookupByLibrary.simpleMessage("グラフの縮尺が変更されました。これにより単位が削除され血糖値の数値のみが表示されます。単位はグラフの下部に表示されます。（デイリーグラフ・ウィークリーグラフ・血糖値パーセンタイルチャート）"),
    "Die Spalten auf der Profilseite wurden korrigiert, damit auch längere Zeitnamen (z.B. in spanisch) Platz finden." : MessageLookupByLibrary.simpleMessage("ページの列表示が修正され、より長い時間名を表示できるようになりました (例：スペイン語など)"),
    "Die Standardabweichung wird jetzt auch bei mmol/L korrekt angezeigt." : MessageLookupByLibrary.simpleMessage("標準偏差は、mmol / L を選択しても正しく表示されるようになりました。"),
    "Die Tagesstatistik zeigt mmol/l-Werte nun korrekt an" : MessageLookupByLibrary.simpleMessage("日別統計のmmol/l表示ができるようになりました。"),
    "Die URL wurde noch nicht festgelegt" : MessageLookupByLibrary.simpleMessage("URLが設定されていません。"),
    "Die URL wurde noch nicht festgelegt." : MessageLookupByLibrary.simpleMessage("URLが設定されていません。"),
    "Die URLs der Benutzer werden nun nach dem Enddatum sortiert." : MessageLookupByLibrary.simpleMessage("The URLs of the users are now sorted according to the end date."),
    "Die Url zur Nightscout-API muss mit https beginnen, da Nightscout Reporter auch auf https läuft. Ein Zugriff auf unsichere http-Resourcen ist nicht möglich." : MessageLookupByLibrary.simpleMessage("ナイトスカウト API の URL は https から始まる必要があります。安全でない http リソースへのアクセスはできません。"),
    "Die Vorschaubilder auf den Kacheln passen sich abhängig von den ausgewählten Optionen teilweise an (z.B. die Auswahl von CGP bei Tagesgrafiken)." : MessageLookupByLibrary.simpleMessage("タイル上のプレビュー画像は、選択したオプションに応じて部分的に調整されます (例、1日グラフに CGP を選択時)。"),
    "Die Webseite verwendet hauptsächlich Javascript zur Erledigung ihrer Aufgaben. Bei der Erzeugung des PDF-Dokuments kommen Javascript und PHP zum Einsatz." : MessageLookupByLibrary.simpleMessage("当サイトは Javascript を利用しています。PDF の作成時には Javascript と PHP が使用されます。"),
    "Die Werte VarK und ToR im CGP werden bei Tages- und Wochengrafiken in der Legende und in der Grafik korrekt ausgegeben." : MessageLookupByLibrary.simpleMessage("CGP 内の VarK と ToR の値が、日付と週のグラフで正しく出力  in the legend and in the graphic. (仮翻訳)\n"),
    "Die Werte für den Standardzielbereich auf der Analyse-Seite werden nun korrekt ermittelt" : MessageLookupByLibrary.simpleMessage("分析ページのデフォルトの目標範囲の値が正しく計算されるようになりました。"),
    "Die Werte im CGP werden jetzt bei mmol-Angaben auch korrekt angezeigt." : MessageLookupByLibrary.simpleMessage("mmol データに対し CGP 内の値が正しく表示されます。"),
    "Die angegebene URL ist nicht erreichbar. Wenn die URL stimmt, dann kann es an den Nightscout-Einstellungen liegen. " : MessageLookupByLibrary.simpleMessage("ご指定の URL にアクセスできません。URL が正しい場合はナイトスカウトの設定を確認してください。 "),
    "Die berechneten IE für Kohlenhydrate in der Tagesgrafik wurden teilweise mit falschen Faktoren ermittelt. Der Fehler wurde behoben." : MessageLookupByLibrary.simpleMessage("デイリーグラフ中の炭水化物用に計算された IE が一部誤った因数で決定されていました。このバグを修正しました。"),
    "Die eigenen Grenzwerte auf der Analyseseite in mmol/L werden nun korrekt berechnet." : MessageLookupByLibrary.simpleMessage("分析ページで mmol/L を使用時の独自制限が正しく計算されるようになりました。"),
    "Die einzelne Seite CGP kann jetzt auch im Querformat ausgegeben werden." : MessageLookupByLibrary.simpleMessage("単一ページの CGP も横書きで出力できるようになりました。"),
    "Die falsche Bezeichnung für durchschnittliche Kohlenhydrate pro Tag in der Tagesstatistik wurde durch die korrekte Bezeichnung für durchschnittliche Kohlenhydrate pro Mahlzeit ersetzt." : MessageLookupByLibrary.simpleMessage("The incorrect name for average carbohydrates per day in the daily statistics has been replaced by the correct name for average carbohydrates per meal."),
    "Die fehlerhafte Platzierug der blutigen Werte bei mmol/L in der Tagesgrafik wurde korrigiert." : MessageLookupByLibrary.simpleMessage("デイリーグラフの血糖値をmmol/L標記にした場合も正しい位置に表示されるようになりました。"),
    "Die fehlerhafte Zentrierung der Auswahlbuttons wurde korrigiert." : MessageLookupByLibrary.simpleMessage("メインページのボタン配置の間違いを修正しました。"),
    "Die glykämische Variabilität stellt die Streuung der Werte um den glykämischen Mittelwert herum in Prozent dar." : MessageLookupByLibrary.simpleMessage("血糖変動係数は、血糖値平均値前後の変動をパーセントで表示したものです"),
    "Die glykämische Variabilität wird jetzt im CGP auch bei Tages- und Wochengrafiken korrekt ausgegeben." : MessageLookupByLibrary.simpleMessage("1日・週間グラフでも、CGP 中の血糖値の変動が正しく表示されます。"),
    "Die meisten Spalten auf der Seite \"Stündliche Statistik\" werden bei nicht vorhandenen Daten leer gelassen." : MessageLookupByLibrary.simpleMessage("「毎時統計」ページのほとんどの列は、データがなければ空のままです。"),
    "Die mittlerweile überflüssige Option zur Darstellung der Basalrate mit zwei Nachkommastellen wurde aus der Tagesgrafik entfernt." : MessageLookupByLibrary.simpleMessage("デイリーグラフからベーサルレート少数点の古いオプションを削除しました。"),
    "Die teilweise falsch zugewiesenen Grenzwerte für die Bereiche (niedrig, normal, hoch) wurden korrigiert." : MessageLookupByLibrary.simpleMessage("一部間違って割り当てていた箇所 (低血糖、普通、高血糖) は修正されました。"),
    "Die temporäre Basalrate am Anfang des Tages wurde bisher falsch gesetzt, wenn sie im vorherigen Tag gesetzt wurde. Das wurde behoben." : MessageLookupByLibrary.simpleMessage("前日の設定がある場合、その日の最初の一時ベーサルレートが誤っていました。修正されました。"),
    "Die Überschrift über der Tabelle vom Glucose Perzentil Diagramm wurde korrigiert." : MessageLookupByLibrary.simpleMessage("The title above the table of glucose percentile diagram has been corrected."),
    "Die Überschrift über der mittleren Spalte im Tagesprofil wurde korrigiert." : MessageLookupByLibrary.simpleMessage("1日プロファイルの中間列の上の見出しを修正しました。"),
    "Diese Seite dient der Erzeugung von PDF-Dokumenten mit den bei Nightscout gespeicherten Daten. Dafür ist es notwendig, auf diese Daten zugreifen zu können, weshalb zunächst ein paar Einstellungen gespeichert werden müssen. Solange diese nicht vorhanden und gültig sind, kann die Seite nichts für Dich tun." : MessageLookupByLibrary.simpleMessage("このページはナイトスカウトのデータを利用してPDFを作成します。最初にこのデータにアクセスできるように設定を保存する必要があります。 設定を保存し有効にしなければ利用できません。"),
    "Diese Seite hinzugefügt. Sie wird jedesmal beim Start von Nightscout Reporter angezeigt, wenn sie in der aktuellen Version noch nicht angezeigt wurde. Ausserdem kann sie im Hamburgermenü wieder aufgerufen werden." : MessageLookupByLibrary.simpleMessage("このページを追加しました。リリースの最新バージョンで表示されていない場合はナイトスカウトレポーターの起動時に表示されます。またメニューから再び表示することもできます。"),
    "Diese Webseite speichert keine Daten auf Servern. Die benötigten Daten werden von der eingegebenen URL zur Nightscout-Instanz geholt und als PDF aufbereitet. Die Daten, die zur Funktion der Webseite benötigt werden, werden im localStorage des Browsers gespeichert und nicht an den Server übermittelt. Wenn die Synchronisierung mit Google Drive aktiviert wird, dann werden diese Daten zusätzlich in den Anwendungsdaten auf dem Google Drive des verbundenen Kontos gespeichert." : MessageLookupByLibrary.simpleMessage("このウェブサイトはサーバー上にデータを保存しません。入力された URL からナイトスカウトの実行プログラムに必要なデータを取得し、またPDFとして出力します。ウェブサイトに必要なデータは、ブラウザのローカルストレージ領域に保存されサーバーには送信されません。Googleドライブの同期がオンになっている場合は、Googleドライブにも保存されます。"),
    "Dieser Regler legt fest, wie gross eine Ausgabe maximal werden darf, bevor sie auf mehrere PDF-Dateien aufgeteilt wird. Wenn bei Erstellung eines PDFs ein leeres Fenster angezeigt wird, dann hilft es normalerweise, diesen Regler weiter nach links zu bewegen." : MessageLookupByLibrary.simpleMessage("このスライダーはPDFが、複数のファイルに分割される時の最大サイズを設定します。PDFを作成する時に空白ページが表示される場合は、このスライダーを左へ移動すると改善する場合があります。"),
    "Dieses Formular ..." : MessageLookupByLibrary.simpleMessage("This form ..."),
    "Dieses Formular zeig die Verteilung der Glukosewerte\nim ausgewählten Zeitraum an." : MessageLookupByLibrary.simpleMessage("This form shows the distribution of the glucose values in the selected period."),
    "Dieses Formular zeigt an, wie sich die Glukosewerte im ausgewählten Zeitraum über den Tag\nverteilen. Diese Verteilung kann graphisch und tabellarisch ausgegeben werden.\n\nIn der Grafik sind die Bereiche für bestimmte Abweichungen farblich markiert. Die Linie zeigt den Medianwert\nan. In der Tabelle kann man diese Werte nachlesen. Wenn die Basalrate mit ausgegeben wird, dann ist das die\nBasalrate, die zu Beginn des ausgewählten Zeitraums aktiv war." : MessageLookupByLibrary.simpleMessage("This form shows how the glucose values are distributed over the day in the selected period. This distribution can be output graphically and in tabular form.\n\nIn the graphic, the areas for certain deviations are color-coded. The line shows the median value. You can look up the values in the table. If the basal rate is also displayed, then this is the basal rate that was active at the beginning of the selected period."),
    "Dieses Formular zeigt das Comprehensive Glucose Pentagon an, welches die Qualität der \nGlukoseeinstellung in einer schnell zu erfassenden Weise darstellt. Es wird für den ausgewählten Zeitraum angezeigt\nwie lange der Glukosewert im Schnitt während des Tages ausserhalb des Zielbereichs war, wie hoch die Intensität\nder Überzuckerungen und der Unterzuckerungen war, wie hoch der Mittelwert war und wie hoch die Variabilität der\nWerte war.\n\nDiese Grafik kann auch bei @05@ und @08@ ausgegeben werden. \n" : MessageLookupByLibrary.simpleMessage("This form displays the Comprehensive Glucose Pentagon, which represents the quality of the glucose control in a readily understood manner. For the selected period it shows how long the average glucose value was outside the target range during the day, how high the intensity of the hyperglycemia and hypoglycemia was, how high the mean value was and how high the variability of the values was.\n\nThis graphic can also be output at @05@ and @08@."),
    "Dieses Formular zeigt das Profil an. Es werden normalerweise alle Profile des ausgewählten\nZeitraums ausgegeben. Wenn sich in dem Zeitraum das Profil geändert hat, wird ein neues Blatt erzeugt.\n\nEs gibt aber eine Option, welche nur das letzte Profil des Zeitraums ausgibt. Ausserdem gibt es eine Option,\nmit der gleiche Zeilen zusammengefasst werden. Das führt zu einem kürzeren Profil, wenn mehrere Zeiten nacheinander\ndie gleichen Werte beinhalten." : MessageLookupByLibrary.simpleMessage("This form shows the profile. Usually all profiles of the selected period are shown. If the profile has changed during this period, a new sheet is created.\n\nHowever, there is an option that only outputs the last profile of the period. There is also an option to combine lines with same values. This leads to a shorter profile if several times in succession contain the same values."),
    "Dieses Formular zeigt den Trend der Glukosewerte über den Tag hinweg \nan. Dabei wird in der Spalte Trend immer angezeigt, um wieviel Prozent sich \nder Wert von einer vollen Stunde zur nächsten verändert hat. Dieser Trend ist\nganz hilfreich, wenn man bei einem Basalratentest erkennen will, wie sich der\nGlukosewert nur anhand der Basalrate entwickelt. Es kann auch eine Spalte für\ndie Boluswerte und die Kohlenhydrate angezeigt werden. Diese sollten aber bei\neinem Basalratentest natürlich leer sein. Ebenso muss ein eventuell\nvorhandener Loop im Zeitraum des Tests abgeschaltet sein. Es geht dabei nur\num den Diabetiker und seine Basalrate.\nEs wird auch eine Spalte mit der\nBasalrate angezeigt, wenn die Option \'Alle Werte für einen Tag anzeigen\'\nnicht markiert wurde. Wenn die Option markiert wurde, dann fehlt der Platz\n(und auch der Sinn), diese darzustellen." : MessageLookupByLibrary.simpleMessage("This form shows the trend in glucose levels over the day. The Trend column always shows the percentage by which the value has changed from one full hour to the next. This trend is very helpful if you want to see in a basal rate test how the glucose value is developing based on the basal rate alone. A column for bolus values and carbohydrates can also be displayed. However, these should of course be empty in a basal rate test. Any existing loop must also be switched off during the test. It\'s all about the diabetic and his basal rate.\n\nA column with the basal rate is also displayed if the option \"Show all values for a day\" is not checked. If the option has been marked, then there is no space (and also the sense) to display it."),
    "Dieses Formular zeigt den Verlauf der Glukosekurve für einen Tag. Pro Tag im ausgewählten\nZeitraum wird eine Seite erzeugt. Es gibt sehr viele Optionen, mit denen dieses Formular angepasst werden kann.\nDie Optionen, die auf einen Loop hinweisen sind andersfarbig markiert, um sie schneller identifizieren zu \nkönnen. Die Optionen COB und IOB verlangsamen die Ausgabe teilweise erheblich, weshalb man diese nur dann\nverwenden sollte, wenn sie wirklich von Interesse sind.\n\nUnter der Grafik kann die Basalrate angezeigt werden. Ein laufender Loop wird diese immer wieder hoch und runter\nsetzen. Deshalb kann man sowohl die tatsächliche Basalrate als auch die im Profil eingestellte Basalrate \nanzeigen lassen. Für die Basalrate gibt es noch die Formulare @09@, @11@ und @02@, auf denen man sie genauer \nanalysieren kann. Man kann auch das @10@ für den Tag erzeugen lassen. Das wird dann auf einer neuen Seite ausgegeben.\n\nDieses Formular ist eines der seitenintensivsten Formulare in Nightscout Reporter. Deshalb gibt es hier \ndie Möglichkeit, mehrere Tagesgrafiken auf einer Seite ausgeben zu lassen. Darunter leidet natürlich die Lesbarkeit,\naber für einen Überblick über den Verlauf ist das ganz nützlich." : MessageLookupByLibrary.simpleMessage("This form shows the the glucose curve for one day. One page is generated per day in the selected period. There are many options that can be used to customize this form. The options that indicate a loop are marked in a different color so that they can be identified very easy. The options COB and IOB sometimes slow down the output considerably, which is why you should only use them if you are really interested in it.\n\nThe basal rate can be displayed below the graphic. A running loop will raise and lower this over and over again. This is why you can display both the actual basal rate and the basal rate set in the profile. For the basal rate there are the forms @09@, @11@ and @02@, on which you can analyze it more precisely. You can also have the @10@ generated for the day. This is then printed on a new page.\n\nThis form is one of the most page-intensive forms in Nightscout Reporter. This is why there is the option of displaying several daily graphics on one page. Of course, legibility suffers from this, but it is very useful for an overview of the progress."),
    "Dieses Formular zeigt den Verlauf der Glukosekurve über eine Woche hinweg an. Der Zeitraum wird\ndazu in Wochenabschnitte aufgeteilt und jede Woche wird auf einer eigenen Seite ausgegeben. Die Wochen werden\nfarblich markiert, so dass man sie gut unterscheiden kann. Zusätzlich kann noch das @10@ für die jeweilige\nWoche erzeugt werden." : MessageLookupByLibrary.simpleMessage("This form shows the glucose curve over a week. The period is divided into weekly segments and each week is displayed on a separate page. The weeks are color-coded so that you can easily distinguish them. In addition, the @10@ can be generated for the respective week."),
    "Dieses Formular zeigt die Auswertung der Werte des ausgewählten\nZeitraums. Dabei wird auch der durchscnittliche Verbrauch an Materialien\nrechnerisch ermittelt und angezeigt. Dieses Formular beinhaltet die meisten\nInformationen, die Diabetologen gerne wissen wollen.\n\nDer HbA1c wird rechnerisch aus den vorhandenen Daten ermittelt und weicht\nnormalerweise nicht unerheblich von dem tatsächlich gemessenen Wert ab. Der\nWert, der aus der Blutprobe ermittelt wird, gibt die tatsächliche Bindung\nvon Glukose im Blut wieder. Da diese von zusätzlichen Faktoren abhängig ist\nund nicht nur von den hier verwendeten Messdaten, ergeben sich Unterschiede\nzum errechneten Wert. Vor allem, wenn es sich bei den gemessenen Werten nicht\num Blutzucker, sondern um Gewebszucker handelt, wie er von CGM-Systemen\nverwendet wird.\n\nTrotzdem ist dieser Wert ein grober Anhaltspunkt für die Qualität der\nGlukoseeinstellung und wird in der vom Labor ermittelten Form gerne von\nDiabetologen als Richtwert verwendet, weshalb er hier angezeigt wird. Er wird\naber in schwächerer Schrift ausgegeben, damit seine zweifelhafte Natur auch\nerkennbar ist." : MessageLookupByLibrary.simpleMessage("This form shows the evaluation of the values ​​of the selected Period. The average consumption of materials is calculated and displayed. This form contains most of the information that diabetologists would like to know.\n\nThe A1C is calculated from the available data and normally deviates not insignificantly from the actually measured value. The value that is determined from the blood sample shows the actual binding of glucose in the blood. Since this depends on additional factors and not only on the measurement data used here, there are differences to the calculated value. Especially when the measured values ​​are not blood sugar but tissue sugar, as used by CGM systems.\n\nNevertheless, this value is a rough guide to the quality of the Glucose setting and in the form determined by the laboratory is often used by diabetologists as a guide value, which is why it is displayed here. But it is issued in a weaker font so that its dubious nature can also be recognized."),
    "Dieses Formular zeigt die Basalrate, die im Profil eingestellt ist in graphischer Form an.\nEs werden normalerweise alle Basalraten des ausgewählten Zeitraums ausgegeben. Wenn sich in dem Zeitraum\ndie Basalrate geändert hat, wird eine neue Seite erzeugt.\n\nEs gibt aber eine Option, welche nur die letzte Basalrate des Zeitraums ausgibt." : MessageLookupByLibrary.simpleMessage("This form shows the basal rate set in the profile in graphic form. Usually all basal rates for the selected period are displayed. If the basal rate has changed in the period, a new page is created.\n\nHowever, there is an option that only outputs the last basal rate of the period."),
    "Dieses Formular zeigt die Daten in tabellarischer Form an. Es kann abhängig von den\nausgewählten Optionen sehr viele Seiten umfassen. Es ist vor allem dafür sinnvoll, um bestimmte Daten aufzufinden.\nZum Beispiel kann man damit ermitteln, wann Katheterwechsel vorgenommen wurden, wieviele Datensätze als doppelt \nerkannt wurden oder wo Notizen erfasst wurden.\n" : MessageLookupByLibrary.simpleMessage("This form shows the data in tabular form. It can consist of very many pages depending on the options you choose. It is especially useful to find certain data. For example, it can be used to determine when the catheter was changed, how many data records were recognized as duplicate or where notes were recorded."),
    "Dieses Formular zeigt die statistischen Werte für die Tage des ausgewählten Zeitraums\nan. Für jeden Tag wird eine Zeile erzeugt. Die Spalten kann man teilweise konfigurieren. Auch hier wird der geschätzte \nHbA1c ausgegeben. Dieser hat wie auch im Formular @01@ nur sehr wenig Aussagekraft, weshalb er auch hier nur mit \nschwächerer Schrift angezeigt wird.\n" : MessageLookupByLibrary.simpleMessage("This form shows the statistical values for the days of the selected period. A line is generated for each day. The columns can be partially configured. The estimated A1C is also output here. As in the @01@ form, this has very little informative value, which is why it is shown here also with a weaker font."),
    "Dieses Formular zeigt die tatsächliche Basalrate, die während des Tages gelaufen ist unter\nBerücksichtigung aller temporären Basalratenanpassungen. Zusätzlich kann noch die im Profil hinterlegte\nBasalrate angezeigt werden. Die Basalrate kann als Wert, als prozentuale Änderung in Bezug auf die Profilbasalrate\noder mit beidem angezeigt werden. Die Summenspalte zeigt die bis zur entsprechenden Uhrzeit abgegebene Basalrate\nan. Es ist auch möglich, die Uhrzeit mit Sekunden anzeigen zu lassen. Damit kann man die angezeigten Werte\nrechnerisch überprüfen.\n\nWenn die Basalrate aus dem Profil angezeigt wird, wird das Maximum für die Darstellung der Balken anhand des\nmaximalen Wertes der Profilbasalrate ermittelt. Dadurch werden bei Werten über 100% des Maximalwerts der \nProfilbasalrate die Balken über die Spalte hinaus verlängert. Es gibt aber eine Option, um diese Balken abzuschneiden \nund als Pfeile darstellen zu lassen." : MessageLookupByLibrary.simpleMessage("This form shows the actual basal rate that has run during the day, taking into account any temporary basal rate adjustments. The basal rate stored in the profile can also be displayed. The basal rate can be displayed as a value, as a percentage change in relation to the profile basal rate, or both. The total column shows the basal rate delivered up to the corresponding time. It is also possible to display the time with seconds. This can be used to mathematically check the displayed values.\n\nIf the basal rate is displayed from the profile, the maximum for the display of the bars is determined using the maximum value of the profile basal rate. As a result, the bars are extended beyond the column for values above 100% of the maximum value of the profile basal rate. But there is an option to cut off these bars\nand to show them as arrows."),
    "Dieses Formular zeigt eine Übersicht für einen Tag. Hier \n  werden die Tagesgrafik, die Basalrate, die Basalratenanpassungen, Insulin On \n  Board und Carbs On Board angezeigt." : MessageLookupByLibrary.simpleMessage("This form shows an overview for one day. Here\n   the daily graph, the basal rate, the basal rate adjustments, Insulin On\n   Board and Carbs On Board displayed."),
    "Dieses Formular zeigt eine Übersicht über die \nStunden der Tage des ausgewählten Zeitraums an. Die angezeigten Werte sind die\nMittelwerte der innerhalb der entsprechenden Stunde gemessenen Werte. Sie\nwerden anhand des ausgewählten Zielbereichs eingefärbt. In den Formularoptionen\nkann man die Startstunde festlegen. Die Datumsspalte befindet sich immer links\nvon 0 Uhr und zeigt an, wo ein neuer Tag beginnt." : MessageLookupByLibrary.simpleMessage("This form shows an overview of the hours of the days of the selected period. The displayed values are the median values of the values measured within the corresponding hour. They are colored based on the selected target area. The start hour can be set in the form options. The date column is always to the left of midnight and shows where a new day begins."),
    "Diverse Abstürze beim Auslesen der Daten bereinigt" : MessageLookupByLibrary.simpleMessage("読み取り時のクラッシュの修正"),
    "Drei Monate vorher" : MessageLookupByLibrary.simpleMessage("3か月前"),
    "Drittes Quartal" : MessageLookupByLibrary.simpleMessage("Third Quarter"),
    "Durchschnitt" : MessageLookupByLibrary.simpleMessage("Average"),
    "Dämmerung (06:00 - 07:59, 18:00 - 20:59)" : MessageLookupByLibrary.simpleMessage("暗い時間 (06:00 - 07:59, 18:00 - 20:59)"),
    "Eigene Grenzwerte" : MessageLookupByLibrary.simpleMessage("自己目標範囲"),
    "Ein Fehler bei der Ausgabe der temporären Ziele in der Tagesgrafik wurde behoben." : MessageLookupByLibrary.simpleMessage("An error in the output of the temporary goals in the daily graphic has been fixed."),
    "Ein Fehler beim Laden der ausgewählten Formulare wurde korrigiert." : MessageLookupByLibrary.simpleMessage("選択したフォームの読み込みエラーを修正しました。"),
    "Ein Fehler in der Zahlenformatierung wurde behoben." : MessageLookupByLibrary.simpleMessage("数値の書式エラーが修正されました。"),
    "Ein Fehler wurde behoben, der bei der Auswahl des Zeitraums die Benutzung verhinderte, wenn man ein leeres Eingabefeld fokussierte." : MessageLookupByLibrary.simpleMessage("A bug has been fixed that prevented usage of the app when selecting the time period if you focused on an empty input field."),
    "Ein Fehler wurde behoben, der dafür sorgte, dass die Anwendung in einem undefinierten Zustand war, wenn man den letzten Benutzer gelöscht hat." : MessageLookupByLibrary.simpleMessage("A bug has been fixed that caused the application to be in an undefined state when the last user was deleted."),
    "Ein Fehler wurde behoben, der dafür sorgte, dass die letzten Tage bestimmter Monate nicht im Kalender-Control angezeigt wurden." : MessageLookupByLibrary.simpleMessage("カレンダー管理の特定月の最後日数が表示されないバグを修正しました。"),
    "Ein Fehler wurde behoben, der dafür sorgte, dass temporäre Ziele in der Tagesgrafik mit zeitlicher Verschiebung angezeigt wurden." : MessageLookupByLibrary.simpleMessage("A bug has been fixed that caused temporary targets to be displayed in the daily graph with a time shift."),
    "Ein Fehler wurde behoben, der dazu führte, dass Dialoge mit Escape geschlossen werden konnten, was die Anwendung in einem unbrauchbaren Zustand zurückliess." : MessageLookupByLibrary.simpleMessage("Fixed a bug that caused dialogs to be closed with Escape, leaving the application in an unusable state."),
    "Ein Fehler wurde behoben, der dazu führte, dass bei fehlenden Daten wie z.B. Treatments gar kein PDF mehr erstellt werden konnte." : MessageLookupByLibrary.simpleMessage("An error has been corrected which resulted in missing data such as treatments no longer being able to create a PDF."),
    "Ein Fehler wurde behoben, der in der Tagesgrafik dazu führte, dass Texte in der Legende andere Texte überschrieben haben." : MessageLookupByLibrary.simpleMessage("デイリーグラフが凡例に被るバグを修正しました。"),
    "Ein Fehler wurde wahrscheinlich behoben, der dazu führt, dass bei manchen Profilen der Wert für DIA nicht korrekt ausgelesen wurde." : MessageLookupByLibrary.simpleMessage("一部のプロファイルで誤って DIA の数値が欠落するバグが修正されました。"),
    "Ein Jahr vorher" : MessageLookupByLibrary.simpleMessage("1年前"),
    "Ein Link zur Facebookseite von Nightscout Reporter wurde im Menü hinzugefügt." : MessageLookupByLibrary.simpleMessage("ナイトスカウトレポーターの Facebook ページへのリンクをメニューに追加しました。"),
    "Ein Shortcut beinhaltet den Zeitraum und die ausgewählten Formulare mit den jeweils gesetzten Optionen. Wenn ein Shortcut aktiviert wird, werden die darin gespeicherten Einstellungen geladen und aktiviert." : MessageLookupByLibrary.simpleMessage("ショートカットには、ピリオドと選択したフォームが含まれています。 ショートカットを有効にすると、保存されている設定が読み込まれ、有効になります。"),
    "Ein möglicher Absturz bei der Ausgabe des CGP bei der Tagesgrafik wurde korrigiert." : MessageLookupByLibrary.simpleMessage("デイリーグラフ内の CGP の出力でクラッシュする可能性が修正されました"),
    "Eine" : MessageLookupByLibrary.simpleMessage("1"),
    "Einen Monat vorher" : MessageLookupByLibrary.simpleMessage("1か月前"),
    "Einheit der Glukosemessung" : MessageLookupByLibrary.simpleMessage("Unit for glucose values"),
    "Einheiten" : MessageLookupByLibrary.simpleMessage("Units"),
    "Einige Browser sind nicht in der Lage PDF Dateien anzuzeigen, die eine bestimmte Grösse überschreiten. Da das von verschiedenen Faktoren abhängt, die sich nicht ohne Weiteres automatisch ermitteln lassen, gibt es die Möglichkeit, statt einer grossen PDF Datei, die nicht angezeigt werden kann, mehrere kleinere PDF Dateien zu erzeugen, die der Browser anzeigen kann. In den Einstellungen und hier kann diese Grösse festgelegt werden. Diese Seite hier wird nur angezeigt, wenn das PDF aufgeteilt werden musste. Wenn nur ein PDF erzeugt wurde, dann wird es direkt angezeigt." : MessageLookupByLibrary.simpleMessage("ブラウザによっては特定のサイズを超える PDF を表示できません。このサイズは様々なの要因によるため自動で決定できないため、表示できない大きなサイズのPDFを分割し、小さなサイズのPDFを複数作成する場合があります。このサイズは設定とここで指定できます。このページはPDFを分割する必要がある場合にのみ表示されます。PDFを分割する必要がない場合は直接表示されます。"),
    "Einige Formulare können nun mit Parametern konfiguriert werden; hierzu den Pfeil am rechten Rand des Formularbuttons anklicken und im aufgeklappten Bereich die entsprechenden Einstellungen vornehmen; der Pfeil erscheint erst, wenn das Formular zum Ausdruck markiert wurde" : MessageLookupByLibrary.simpleMessage("一部の印刷用フォームはパラメーターを使用して設定できるようになりました。フォームボタンの右側にある∨矢印をクリックして、下に開いたチェックボックスで表示設定をします。フォームボタンを選択するまで∨矢印は表示されません。"),
    "Einige der Optionen für die PDFs wurden hierarchisch angeordnet. Es macht z.B. keinen Sinn, die SMB Werte in der Tagesgrafik an der Kurve platzieren zu lassen, wenn die SMB Werte gar nicht angezeigt werden. Deswegen werden Optionen, die von einer anderen Option abhängen nur dann angezeigt, wenn die entsprechende Option markiert ist. Dadurch ändert sich leider auch die Speicherung der Optionen, weshalb sich die aktuelle Auswahl der Optionen bei manchen PDFs verändert. Da müssen die Optionen dann neu gesetzt werden." : MessageLookupByLibrary.simpleMessage("PDF のオプションの一部が階層で配置されました。SMB 値がまったく表示されていない場合には、デイリーグラフに配置されている意味がありません。そのため、別のオプションに依存するオプションは、対応するオプションを選択した場合にのみ表示されるようにしました。これは残念ながらオプションの保存方法も変えてしまい、現在の一部の PDF のオプションの選択方法が変更されました。これらのオプションは、再び設定する必要があります。"),
    "Einstellungen" : MessageLookupByLibrary.simpleMessage("設定"),
    "Einstellungen für die Verwendung der Seite vornehmen" : MessageLookupByLibrary.simpleMessage("設定"),
    "Einstellungen von Release-Version übernehmen" : MessageLookupByLibrary.simpleMessage("リリースバージョンから設定を移行"),
    "Einstiegsvideo" : MessageLookupByLibrary.simpleMessage("Quickstartvideo"),
    "English (GB)" : MessageLookupByLibrary.simpleMessage("英語 (イギリス)"),
    "English (USA)" : MessageLookupByLibrary.simpleMessage("英語 (アメリカ)"),
    "Ermittle ersten Tag mit Daten" : MessageLookupByLibrary.simpleMessage("データを含む最初の日を検索中"),
    "Ermittle letzten Tag mit Daten" : MessageLookupByLibrary.simpleMessage("データを含む直近の日を検索中"),
    "Erstes Quartal" : MessageLookupByLibrary.simpleMessage("First Quarter"),
    "Erzeuge PDF..." : MessageLookupByLibrary.simpleMessage("PDFを作成中…"),
    "Es gibt ein neues Formular namens \"Verteilung der Glucosewerte\". Das zeigt die prozentuale Verteilung der Glukosewerte für den ausgewählen Zeitraum an." : MessageLookupByLibrary.simpleMessage("There is a new form called \"Distribution of glucose values\". This shows the percentage distribution of the glucose values for the selected period."),
    "Es gibt ein neues PDF namens Tagesstunden. Dieses zeigt die Durchschnittswerte eines Tages in jedem Stundenintervall an und färbt die Zellen entsprechend des Glukosewertes ein. So hat man eine gut Übersicht über die Werteverteilung im ausgewählten Zeitraum." : MessageLookupByLibrary.simpleMessage("日別毎時間 (Dayhours) と命名された新しい PDF が追加されました。時間単位の間隔で1日の平均値を表示し、ブドウ糖値に応じてマスの背景色を変えます。選択期間中の値の分かりやすい概要が提供されます。"),
    "Es gibt ein neues PDF namens Tagestrend. Dieses zeigt die Werte eines Tages zusammen mit dem Trend zu jeder vollen Stunde, sowie der eingestellten Basalrate aus dem Profil. Das ist eine gute Übersicht für Basalratentests, um zu erkennen, wo etwas anzupassen ist." : MessageLookupByLibrary.simpleMessage("1日の傾向と名付けられた新しいPDFが用意されました。これは1日の値を時間ごとの傾向とプロファイルに設定された基礎単位と共に表示します。これは、基礎単位テストで調整が必要な箇所を確認するための良い概要となります。"),
    "Es gibt eine neue Option in der Tagesgrafik mit der man den Zielwert ein- und ausblenden kann." : MessageLookupByLibrary.simpleMessage("There is a new option in the daily graph with which you can show and hide the target value."),
    "Es gibt eine neue PDF-Seite für die Tagesprofile. Darauf ist eine Tabelle zu sehen, die die tatsächliche Basalrate für den Tag zeigt, inklusive aller temporären Anpassungen. Ich brauchte das für Debugzwecke, aber vielleicht findet das der eine oder andere Benutzer auch interessant. Das Profil, das dort angezeigt wird entspricht dem Tagesprofil auf der Seite Tagesgrafik. Beim Loopen können das sehr viele Seiten werden, da dort normalerweise alle paar Minuten Anpassungen an der Basalrate vorgenommen werden. Deswegen wird die Tabelle auch abhängig von der Datenmenge in maximal drei Spalten dargestellt, um die Anzahl an Seiten zu reduzieren." : MessageLookupByLibrary.simpleMessage("デイリープロファイル用の新しい PDF が追加されました。すべての一時的な調整を含む、1日の実際の基礎単位の表\nが含まれています。デバッグのためにこれが必要でしたが、一部の利用者にも興味深いものでしょう。そこに表示されるプロファイルは、1日グラフのページの1日プロファイルに対応します。基礎単位は通常数分ごとに調整され、Loop は多くのページを生成します。そのため、データの量に応じてページ数を減らすために、最大3列で表が表示されます。"),
    "Es gibt in den Einstellungen eine Option, das PDF herunterladen zu lassen, statt es im Browser direkt anzeigen zu lassen. Das wird für Browser wie Edge benötigt." : MessageLookupByLibrary.simpleMessage("Edgeブラウザなどのブラウザ用に、PDFをブラウザで表示せずにダウンロードするオプションが設定にあります。"),
    "Es gibt in den Einstellungen eine neue Option, um den letzten in Nightscout gespeicherten Glukosewert in der Titelzeile anzeigen zu lassen. Wenn diese Option aktiviert ist, wird der aktuelle Wert, das Alter des Wertes, der Trendpfeil und die Differenz zum vorherigen Wert rechts in der Titelzeile angezeigt. Diese Anzeige wird jede Minute aktualisiert, solange das Browserfenster den Eingabefokus besitzt. Wenn es diesen nicht hat, wird die Aktualisierung angehalten und der Wert ausgeblendet, um nicht unnötig Systemresourcen zu belasten." : MessageLookupByLibrary.simpleMessage("この設定には基礎単位に保存されている最新の血糖値をタイトルバーに表示する新しいオプションがあります。有効にすると、現在の血糖値・経過時間・トレンド矢印及び以前の血糖値との差がタイトルバーの右側に表示されます。\nこの表示はブラウザに入力カーソルがある時は、毎分更新されます。入力カーソルがない場合はシステムの負荷を避けるため、値は非表示になります。"),
    "Es gibt jetzt Shortcuts, mit denen man die aktuelle Auswahl der Formulare, deren Parameter und den ausgewählten Zeitraum speichern kann. Beim Aktivieren eines Shortcuts wird das alles wieder so eingestellt, wie es war, als der Shortcut gespeichert wurde." : MessageLookupByLibrary.simpleMessage("There are now shortcuts with which you can save the current selection of forms, their parameters and the selected period. When activating a shortcut, everything is set back to what it was when the shortcut was saved."),
    "Es gibt jetzt auch die Möglichkeit, Nightscout Reporter in europäischem Englisch darzustellen. Der Unterschied zum amerikanischen Englisch besteht derzeit lediglich im Datumsformat (gb: dd/MM/yyyy, us: MM/dd/yyyy)." : MessageLookupByLibrary.simpleMessage("ナイトスカウトレポーターをイギリス英語で使用できるようになりました。アメリカ英語との違いは日付表示のみです。(例：dd/MM/yyyy, us: MM/dd/yyyy)"),
    "Es gibt jetzt die Möglichkeit, PDFs vergangener Zeiträume zu erzeugen, ohne den Zeitraum anpassen zu müssen. Oberhalb des Buttons zur PDF-Erzeugung gibt es zwei Buttons, welche die PDFs für eine frühere Periode erzeugen. Der untere der beiden Buttons erzeugt die Vorperiode, der obere die vorletzte Periode. Auf den Buttons wird das Startdatum und das Enddatum angezeigt. Wenn z.B. als Zeitraum \"Letzte 2 Wochen\" gewählt wurde, dann wird mit dem unteren Button der Zeitraum von zwei Wochen beginnend vor vier Wochen erzeugt und mit dem oberen Button der Zeitraum von zwei Wochen beginnend vor sechs Wochen. Auf diese Art kann man recht einfach Vergleichsberichte erzeugen, um die Entwicklung der Werte zu erkennen. Auf den Seiten wird für diese Ausdrucke in der Kopfzeile das Wort \"Historisch 1\", bzw. \"Historisch 2\" oberhalb des Zeitraums ausgegeben. So kann man beim Vergleich der Werte die Daten voneinander unterscheiden." : MessageLookupByLibrary.simpleMessage("期間を新たに設定しなくても、過去に表示した期間の PDF を作成できるようになりました。PDF を作成するボタンの上に、前の期間を選択するボタンがふたつあります。ふたつのボタンの内、下側が直近に選択した期間で上側が最後から2番目の期間となります。ボタンには開始日と終了日が表示されます。また期間「過去1週間」を選択すると、下側のボタンは4週前から始まる2週間の期間と上側のボタンでは4週間前から始まる2週間の期間が作成されます。\nこのように数値の変化を比較する為のレポートを容易に作成できます。またヘッダーに印刷されるページでは、上部に「履歴1」「履歴2」と表示されます。"),
    "Es gibt jetzt kleine Hilfebuttons bei den Formularen. In der Listenansicht ersetzen sie die Icons zum Ziehen der Formulare, in der Kachelansicht werden sie links oben auf den Kacheln dargestellt. Die jeweilige Ansicht kann man im Hamburgermenü auswählen. Beim Anklicken eines solchen Buttons wird ein Text angezeigt, der beschreibt, was das entsprechende Formular darstellt." : MessageLookupByLibrary.simpleMessage("There are now small help buttons on the forms. In the list view they replace the icons for dragging the forms, in the tile view they are displayed on the top left of the tiles. The respective view can be selected in the hamburger menu. When you click on such a button, a text is displayed that describes what the corresponding form shows."),
    "Es gibt keine mehrfachen Datensätze." : MessageLookupByLibrary.simpleMessage("There are no multiple datasets."),
    "Es ist in der Kachelansicht jetzt möglich, Formulare zu duplizieren, um verschiedene Ansichten des gleichen Formulars auf einmal zu erzeugen. Dazu gibt es rechts unten auf den Kacheln ein Kopier-Icon. Wenn dieses ausgelöst wird, dann wird das aktuelle Formular kopiert und als neue Kachel hinter der aktuellen Kachel eingefügt. Diese kann dann genauso behandelt werden, wie jede andere Kachel. Auf dieser neuen Kachel gibt es rechts unten ein Mülleimer-Icon. Wenn dieses ausgelöst wird, dann wird die Kachel wieder entfernt. Von einem Formular können maximal 2 Kopien erstellt werden. Die Optionen der Formulare werden ebenso wie die Reihenfolge wie bisher auch gespeichert. Die kopierten Kacheln bleiben also erhalten. In der Listenansicht tauchen die kopierten Formulare auch auf. Allerdings gibt es dort nicht die Möglichkeit, sie zu kopieren oder zu löschen. Das muss in der Kachelansicht erfolgen." : MessageLookupByLibrary.simpleMessage("It is now possible to duplicate forms in the tile view in order to create different views of the same form at once. There is a copy icon on the bottom right of the tiles. When this is triggered, the current form is copied and inserted as a new tile behind the current tile. This can then be treated in the same way as any other tile. There is a trash can icon at the bottom right of this new tile. When this is triggered, the tile is removed. A maximum of 2 copies can be made of a form. The options for the forms, as well as the order, are saved as before. The copied tiles are therefore retained. The copied forms also appear in the list view. However, there is no possibility of copying or deleting them there. This must be done in the tile view."),
    "Es ist jetzt möglich, die Buttons zur PDF-Auswahl als Kacheln darstellen zu lassen. Die Option dazu ist im Menü auf der linken Seite zu finden. In der Kachelansicht werden die Buttons über die verfügbare Fläche verteilt und sind so auf kleinen Geräten leichter zu treffen. Ausserdem sieht man dann normalerweise alle verfügbaren PDFs auf einen Blick und muss nicht scrollen. Auf den aktivierten Kacheln wird angezeigt, an welcher Stelle im PDF die entsprechenden Seiten ausgegeben werden und wieviele Seiten die entsprechende Kachel ausgibt. Diese Zahl kann für die meisten Kacheln korrekt ermittelt werden, bei einigen ist das aber ohne Auswertung der Daten nicht möglich (z.B. Profile und Protokoll). In diesem Fall wird entweder keine Seitenzahl oder eine Mindestzahl an Seiten angegeben. Sobald die Erstellung des PDFs erfolgt ist, werden die korrekten Zahlen angezeigt. Die Reihenfolge der Kacheln kann verändert werden, indem man sie festhält und an die Stelle verschiebt, an der man sie gerne hätte. Nach Anklicken des Icons in der oberen rechten Ecke können die Parameter für das entsprechende PDF erfasst werden." : MessageLookupByLibrary.simpleMessage("PDFを選択するボタンがタイルとして表示できるようになりました。このオプションは左側のメニューより設定できます。タイルビューでは、小さなデバイスでも画面内にボタンが配置され表示が容易になります。表示可能なPDFがスクロールせずに全て表示されます。アクティブにしたタイルには、PDFで印刷される場所とページ数が表示されます。この数はほとんどのタイルで正しく決定できますが、データ分析(例: プロファイルとプロトコル) を行わないと決定できないタイルもあります。この場合、ページ番号を指定しないか、最小ページ数を指定します。PDFが作成されると、正しい番号が表示されます。タイルを持って好きな場所に移動することで、印刷の順番を変えることができます。右上隅のアイコンをクリックすると、対応するPDFのパラメータをキャプチャできます。"),
    "Es ist jetzt möglich, die Einstellungen auf Google Drive zu speichern. Das hat den Vorteil, dass man die Einstellungen nicht nur im aktuellen Browser hat, sondern bei jedem Browser, mit dem man sich bei Google anmeldet. Die Einstellungen werden nach wie vor im Browser gespeichert. Bei einer Verbindung zu Google Drive werden sie aber zusätzlich auf Google Drive gespeichert. Beim Laden der Seite wird überprüft, ob eine Synchronisierung gewünscht ist. Wenn das der Fall ist, dann werden die Daten von Google Drive heruntergeladen. Wenn die Daten darin neuer sind als die Daten im Browser, werden sie verwendet. Nach dem Speichern der Daten werden bei aktivierter Synchronisierung diese Daten mit dem aktuellen Zeitstempel auf Google Drive gespeichert. Die Synchronisierung wird im Menü auf der linken Seite aktiviert und deaktiviert. Sie kann auch beim erstmaligen Aufruf der Seite in einem neuen Browser direkt im Willkommensbildschirm aktiviert werden. Nightscout Reporter verlangt nur die Berechtigung die eigenen App-Daten zu speichern und zu laden und benötigt keinen Zugriff auf andere Daten auf Google Drive." : MessageLookupByLibrary.simpleMessage("設定を Google ドライブに保存可能になりました。この利点は、現在のブラウザだけでなく、あなたの Google アカウントに接続されているどのブラウザでも設定を保持できるということです。設定はまだブラウザにも保存されたままです。Google ドライブに接続している場合、Google ドライブにも保存されます。ページを読み込み時に同期が必要かどうかを確認します。必要であれば、データが Google ドライブからダウンロードされます。ダウンロードしたデータがブラウザのデータよりも新しい場合、それが使用されます。データが保存されると、同期はそのデータを現在の日時でGoogle ドライブに保存します。同期の有効・無効化は、左側のメニューから可能です。また、新しいブラウザで初めてページを呼び出すときにも、ようこそ画面から有効にすることができます。ナイトスカウトレポーターには、自らのアプリ用データを保存して読み込む許可が必要なだけで、Google ドライブ上の他のデータにアクセスする要求はありません。"),
    "Es ist jetzt möglich, die Wochentage festzulegen, die im Zeitraum berücksichtigt werden sollen. Die entsprechenden Tage werden bei der Auswahl des Zeitraums mit den Buttons unterhalb des Monats festgelegt. Auf den PDFs werden Zeiträume dann zusätzlich mit der Information versehen, welche Wochentage berücksichtigt werden, wenn es nicht alle sind." : MessageLookupByLibrary.simpleMessage("期間選択で使用する曜日選択が可能になりました。期間選択をするとカレンダーの下側で使用曜日を選択できます。PDF作成では曜日選択をした場合、選択期間とともに使用曜日が表示されます。"),
    "Es sind keine Daten für den Ausdruck vorhanden" : MessageLookupByLibrary.simpleMessage("表示可能なデータがありません"),
    "Es sind keine Daten vorhanden." : MessageLookupByLibrary.simpleMessage("利用可能なデータがありません。"),
    "Es werden jetzt auch blutige Werte erkannt, die von Loop auf dem IPhone eingetragen werden." : MessageLookupByLibrary.simpleMessage("iPhone の Loop で血糖値を入力した場合も認識するようになりました。"),
    "Español" : MessageLookupByLibrary.simpleMessage("スペイン語"),
    "Exportieren" : MessageLookupByLibrary.simpleMessage("エクスポート"),
    "Facebook Seite" : MessageLookupByLibrary.simpleMessage("Facebook"),
    "Fehler" : MessageLookupByLibrary.simpleMessage("Error"),
    "Fehler behoben, der bei der Kachelansicht teilweise verhindert hat, dass die Parameter für die Kacheln aufgerufen werden konnten." : MessageLookupByLibrary.simpleMessage("タイルビューでタイル用のパラメータが呼び出しが阻止されていたバグを修正しました。"),
    "Fehler beim Laden der Daten" : MessageLookupByLibrary.simpleMessage("データ読込エラー"),
    "Fehler werden besser abgefangen und mit sinnvollem Text ersetzt." : MessageLookupByLibrary.simpleMessage("エラーを適切に処理し、意味が分かる文に置き換えられます。"),
    "Fehlerhafte Ausgabe der Blutzuckerwerte in der täglichen Grafik korrigiert." : MessageLookupByLibrary.simpleMessage("デイリーグラフの誤った血糖値出力が修正されました。"),
    "Fehlerhafte Messwerte werden in der Auswertung der Grafiken nicht mehr brücksichtigt; diese werden an dem Wert \"NONE\" im Datenfeld \"direction\" erkannt" : MessageLookupByLibrary.simpleMessage("間違った値はグラフの表示で評価されなくなりました。データフィールドの「矢印」や「なし」によって認識されます。"),
    "Fehlermeldung beim Laden von Profilen ohne Startdatum entfernt." : MessageLookupByLibrary.simpleMessage("開始日の入力のないプロファイルを読み込んだ際のエラーメッセージを削除しました。"),
    "FixAAPS30: Die Erstellung der PDFs kann extrem lange dauern. Das liegt an einer Flut von Profil-Switches, die durch ein Plugin für die Automatisierung erstellt werden. Das verursacht einen Profil-Switch alle 4 Minuten mit Speicherung des kompletten Profils. Wenn die Option aktiv ist, dann werden diese Profil-Switches aussortiert und ermöglichen dadurch die Erstellung des PDFs. Diese Profil-Switches sind dann in den PDFs nicht mehr sichtbar." : MessageLookupByLibrary.simpleMessage("FixAAPS30: The creation of the PDFs can take an extremely long time. This is due to a flood of profile switches that are created by a plug-in for automation. This causes a profile switch every 4 minutes with storage of the complete profile. If the option is active, then these profile switches are sorted out and thus enable the creation of the PDF. These profile switches are then no longer visible in the PDFs."),
    "Français" : MessageLookupByLibrary.simpleMessage("フランス語"),
    "Für die Tagesgrafik gibt es jetzt eine Option, um die Aufsummierung nahe beieinander liegender Werte umzuschalten." : MessageLookupByLibrary.simpleMessage("1日グラフに、時間帯が近い数値をまとめるオプションが追加されました。"),
    "GPD" : MessageLookupByLibrary.simpleMessage("GPD"),
    "Geburtstag" : MessageLookupByLibrary.simpleMessage("生年月日"),
    "Gelbe Kreise zeigen an, dass der entsprechende Wert die Skala überschreitet." : MessageLookupByLibrary.simpleMessage("黄色の丸は、対応する値がスケールを超えていることを示します"),
    "Genauigkeit der Basalangaben:" : MessageLookupByLibrary.simpleMessage("基礎の値の精度:"),
    "Ges." : MessageLookupByLibrary.simpleMessage("計"),
    "Gesamt" : MessageLookupByLibrary.simpleMessage("合計"),
    "Geschätzter HbA1c" : MessageLookupByLibrary.simpleMessage("推定A1C"),
    "Glukose Pentagon erzeugen" : MessageLookupByLibrary.simpleMessage("グルコース総合グラフを表示"),
    "Glukose Perzentil Diagramm" : MessageLookupByLibrary.simpleMessage("血糖値変動パターン"),
    "Glukose im Zielbereich" : MessageLookupByLibrary.simpleMessage("目標範囲内"),
    "Glukose zu hoch" : MessageLookupByLibrary.simpleMessage("血糖値が非常に高い"),
    "Glukose zu niedrig" : MessageLookupByLibrary.simpleMessage("血糖値が非常に低い"),
    "Glukosekurve" : MessageLookupByLibrary.simpleMessage("血糖値曲線"),
    "Glukosewert" : MessageLookupByLibrary.simpleMessage("グルコース"),
    "Glykämischer Variabilitäts Index (GVI)" : MessageLookupByLibrary.simpleMessage("血糖値変動指数 (GVI)"),
    "Google Assistant" : MessageLookupByLibrary.simpleMessage("Google アシスタント"),
    "Grafik" : MessageLookupByLibrary.simpleMessage("図"),
    "Grafiken pro Seite" : MessageLookupByLibrary.simpleMessage("1ページのグラフ数"),
    "Grenzwerte wurden nicht durchgängig gleich behandelt. Jetzt sollte die Zuordnung der Werte zu den Zielbereichen im gesamten Programm identisch sein." : MessageLookupByLibrary.simpleMessage("Limit values were not consistently treated in the same way. The assignment of the values to the target areas should now be identical in the entire program."),
    "Gross" : MessageLookupByLibrary.simpleMessage("大"),
    "Gruppierung der Zeiten" : MessageLookupByLibrary.simpleMessage("時間帯をまとめて表示"),
    "HTML-Notizen anzeigen" : MessageLookupByLibrary.simpleMessage("HTMLメモを表示"),
    "Heute" : MessageLookupByLibrary.simpleMessage("今日"),
    "Hiermit wird festgelegt, um wieviel der Zeitraum des PDFs verschoben werden soll, um Vergleichswerte zu erhalten." : MessageLookupByLibrary.simpleMessage("これは、比較用の値を得るために PDF の期間をどれだけ推移すべきかを決定します。"),
    "Hinweise auf Nightscout in der Kopf- und Fusszeile des PDFs ausblenden" : MessageLookupByLibrary.simpleMessage("PDF のヘッダとフッターにナイトスカウトの情報を表示しない"),
    "Hinzufügen" : MessageLookupByLibrary.simpleMessage("追加"),
    "Historische Daten" : MessageLookupByLibrary.simpleMessage("履歴データ"),
    "Hochformat" : MessageLookupByLibrary.simpleMessage("縦向き"),
    "Hohe Basalraten werden jetzt besser dargestellt." : MessageLookupByLibrary.simpleMessage("高いベーサルレートも正しく表示されます。"),
    "Höchster Wert im Zeitraum" : MessageLookupByLibrary.simpleMessage("期間中の最高血糖値"),
    "IE" : MessageLookupByLibrary.simpleMessage("U"),
    "IE-Anzeige" : MessageLookupByLibrary.simpleMessage("IE-Display"),
    "IE/std" : MessageLookupByLibrary.simpleMessage("U/hr"),
    "IOB (Insulin On Board) anzeigen" : MessageLookupByLibrary.simpleMessage("IOB (インスリン On Board) を表示"),
    "Im CGP wurden die Skalenbeschriftungen korrigiert." : MessageLookupByLibrary.simpleMessage("The scale labels have been corrected in the CGP."),
    "Im CGP wurden verschiedene Berechnungen korrigiert, die sich vor allem in Differenzen bei ToR und Mittelwerten zeigten." : MessageLookupByLibrary.simpleMessage("CGP では各種計算を修正しました。主に ToR と平均値の差で示されていました。"),
    "Im Dialog der Ausgabe Parameter gibt es nun die Möglichkeit, das CGP immer mit dem Standard Zielbereich zu erzeugen. Diese Option ist anfangs eingeschaltet, da das CGP ein standardisiertes Formular ist, das gerne zu Vergleichszwecken herangezogen wird. Man kann es aber für seine eigenen Zwecke ausschalten. Diese Einstellung wird dann auch beibehalten." : MessageLookupByLibrary.simpleMessage("In the dialog of the output parameters there is now the possibility to always generate the CGP with the standard target area. This option is initially activated because the CGP is a standardized form that is often used for comparison purposes. But you can turn it off for your own purposes. This setting is retained."),
